start	end	text
1128660	1132740	He's loving, consistent, and he chose to wait for me for six months without having sex.
1132740	1136460	Two weeks back we made love and the next day he changed, stopped picking calls and
1136460	1138180	responding to my texts saying he's busy.
1138180	1139980	He made me fall in love and I'm now confused.
1139980	1142680	I mean, he's a piece of shit for cheating, but look what you're doing.
1142680	1145760	You were fucking around with this guy for six months knowing he was married.
1145760	1147020	What the fuck is wrong with you?
1147020	1151140	If I cheated on you, instead of leaving me, just understand the fact that you lack something
1151140	1153460	which the man I cheated on you with doesn't.
1153460	1157580	Find out the error in yourself, apologize to me, say sorry, accept it, and become a
1157580	1158580	better man.
1158580	1160680	You are actually just a piece of shit.
1160680	1165040	It's this assumption that woman equals good in all situations.
1165040	1169680	And so whatever that women do, then it's automatically validated because why not?
1169680	1170680	Girl power.
1170680	1173900	Yeah, this whole thing is just depressing.
1173900	1177660	It's a fundamental misunderstanding of what romance should be, in my opinion.
1177660	1184520	It's definitely a consequence of the modern day hookup culture and it's not just the fault
1184520	1187900	of women, but it's also the fault of men because like I said, there is a mere version of this
1187900	1189700	on the man's side of things.
1189700	1194260	A truly fulfilling relationship.
1194260	1196980	You don't keep score like this.
1196980	1199880	Now you both have to contribute.
1199880	1203020	It's not that you can just, oh, we're not keeping a score, so I'll just exploit the
1203020	1204020	fuck out of my partner.
1204020	1205020	No, you can't do that.
1205020	1211320	But the idea is you put everything you have into your relationship because you genuinely
1211320	1215040	care for the other person on both sides.
1215040	1221160	And if sometimes one of them kind of falls apart because life sucker punches you, sometimes
1221160	1222160	it happens.
1222160	1226520	You have a health problem, you lose your job out of nowhere, you get laid off, get into
1226520	1231760	an accident, whatever it is, there are things that are just not your fault that can happen
1231760	1233040	to you.
1233040	1237420	And now suddenly you're not the strong, stable provider.
1237420	1244360	Now suddenly you're not the cute, perky, happy young woman that he married.
1244360	1251080	Whatever it is, what keeps you going in those down times, it's not going to be sexual attraction.
1251080	1255880	It's not going to be any of this kind of ruthless calculus.
1255880	1258800	It's not going to be money, that can help depending on what you're talking about, but
1258800	1261060	ultimately it's not going to be money.
1261060	1263320	It's going to be your love for each other.
1263320	1268120	The reason that most cultures have this view of monogamy that includes something like,
1268120	1271540	though not always with the same words every time, but something like in sickness and in
1271540	1278500	health, rich or poor, stuff like that, is that you're making a commitment to each other,
1278500	1282060	but you're making a commitment to the metaphysical idea of each other, not just what you can
1282060	1283060	bring to the table.
1283060	1285660	That's important, that's not nothing, but it's also not all of it.
1285660	1288740	And I think that's what these people don't understand.
1288740	1293060	These genuinely seem like people who are not capable of love.
1293060	1297740	And honestly, like sometimes when I do a Reddit video on this channel, I'll laugh, I'll have
1297740	1300940	a good little giggle about it, it'll be like stupidity.
1300940	1302700	This just made me feel really fucking sad.
