start	end	text
0	5000	The next atomic bomb is made of DNA, and it's as affordable as a new car.
5000	11000	In recent years, genetic data has become more available, knowledge more widespread, and lab resources less expensive.
11000	18000	Bioengineering had previously been restricted to well-funded laboratories, where research produced marvels like gene therapy and COVID-19 vaccines.
18000	23000	But now, it's getting increasingly open to anyone willing to spend a year's salary on lab equipment.
23000	27000	That includes people who want to do harm, who are poorly trained in safety, or just reckless.
27000	32000	From terrorist attacks to lab accidents, the effects of a loose engineered virus could be devastating.
32000	39000	In 1945, the Manhattan Project spawned the threat of nuclear annihilation, while simultaneously providing the key to nuclear power.
39000	46000	Biotech is just as threatening today, and few people are even aware of how powerful it's become, and will become, in the next few years.
46000	53000	We don't have decades to do something about it. We must act. Now. But how? Watch the full video on our channel to find out.
