start	end	text
1469140	1473140	But thankfully, the rise of the internet has really helped level the playing field.
1473140	1476140	Corporations and world governments have caught on to this,
1476140	1482140	which is why they've spent much of the last decade trying to regulate, control, and censor everything they can.
1482140	1485140	And that brings us to this video's sponsor.
1486140	1489140	NordVPN
1489140	1499140	Mark Zuckerberg and Susan Wojcicki are making out right now on a pile of money that they got from selling your information to shady companies who want to spam you with minions ads.
1499140	1505140	Using a VPN will help make it harder for massive tech companies to leech off of your personal data.
1505140	1512140	Any of you out there right now browsing the web completely unprotected are basically giving ruthless tech CEOs free money.
1512140	1518140	So how about getting yourself a nice slice of NordVPN and demonetizing Susan for a change?
1518140	1522140	And don't think I've forgotten about you poor saps over there in Europe.
1522140	1527140	Your corrupt legion of unelected bureaucrats are trying to ban everyone from everything.
1527140	1534140	Let's not kid ourselves here, Article 13 is going to pass, because when has the EU ever done anything to help Europeans?
1534140	1538140	It's not going to do anything to YouTube, because nothing ever does.
1538140	1544140	So naturally that just leaves you Europeans to bear the full brunt of your government's bad ideas.
1544140	1548140	So don't let your government tell you what memes you can and can't share.
1548140	1554140	Use NordVPN to relocate your IP address to a country that's not completely spineless.
1554140	1559140	Take back control of your web browsing and experience the internet as it was intended.
1559140	1567140	Defend yourself today by visiting nordvpn.com slash mplemon, where you can get access to all of these features for just a small monthly fee.
1567140	1573140	But can you really put a price on freedom? Yes you can, and that price is $12 a month.
1573140	1580140	But through this special offer, you can use the code mplemon to get NordVPN for just $2.99 a month.
1580140	1584140	They'll even throw in an extra month absolutely free.
1584140	1590140	So visit nordvpn.com right now and stop giving Susan's jet ski free money.
1590140	1599140	Give me free money instead by clicking the link in the description and purchasing the product so that this ad performs well and more companies want to sponsor me.
1599140	1607140	You should also do it for all that stuff I said earlier. Whatever. Go buy yourself some Nord. It's like putting a condom on your internet.
