start	end	text
2467700	2472700	For me though, I would never assume that someone has that intent inside of them just because they're against me.
2472700	2476700	Have I dealt with people with ill intent? Sure, but it's not worth making that assumption.
2476700	2481700	I know a lot of people have a real emotional connection to their channel, and to these causes,
2481700	2485700	and I wouldn't risk depriving them of that just because they said some mean things about me,
2485700	2488700	which is what it came down to, and I've tried to be nice to Oxhorn today
2488700	2494700	because I don't want to present a binary choice to people who may enjoy his content and his personality.
2494700	2500700	Do they either have to agree with the criticisms and thus hate him, or disagree with all of them and love him,
2500700	2506700	because then people will reverse the formula and derive their positions on the criticisms from how much they like their YouTubers,
2506700	2509700	and you can never really find any resolution there.
2509700	2513700	The truth is, when these things are brought up, people are prepared to forgive.
2513700	2518700	If people are calling you out, most audiences won't just hear that and assume you're evil from now on,
2518700	2520700	they want to hear your perspective.
2520700	2527700	This situation has spiralled beyond anyone's comprehension, and I want to address it because there are some real messages to take away from it.
2527700	2534700	If you're not a non, or other variances, audiences aren't going to crucify you if you're honest and upfront about your mistakes.
2534700	2540700	Don't try and destroy smaller channels because they make videos on you. Smaller channels aren't going to destroy your career,
2540700	2545700	they're more just a way to casually keep your ego in check, even if their criticisms aren't the best.
2545700	2549700	They're normally rooted in some sentiment that you can link back to a point.
2549700	2554700	If those criticisms aren't legitimate, then you can ignore them, and chances are they won't gain traction.
2554700	2557700	If they are legitimate, they probably won't gain that much traction either.
2557700	2562700	Just keep them in mind, address them in a post if you need to, then at least you've established your position.
2562700	2570700	I don't support cancel culture, but you can't go in the absolute opposite direction and attempt to just wipe out any evidence of these things happening,
2570700	2574700	because it doesn't change the fact that they happened, and people will still reflect on them.
2574700	2580700	There is a lot that I haven't spoken about that other channels have, and generally that's because I don't think it adds to the narrative.
2580700	2586700	People have said and done stuff on the internet, which we will be asked about, sometimes called out for.
2586700	2593700	What matters is that we don't try and let the paranoia about presenting a squeaky clean image drive us to attempt to silence those voices,
2593700	2596700	even if we think those voices are wrong or misled.
2598700	2605700	So yes, we are at the end of the video again, I want to give a big shoutout to the editors who have done a fantastic job as ever,
2605700	2610700	I'm gonna leave their links in the pinned comment below, definitely go and check them out.
2610700	2614700	Also, would love to hear your thoughts on this video, on the topic, it's an interesting one for sure,
2614700	2618700	I'm sure a lot of my viewers do not know about it, but I wanted to have a discussion over it,
2618700	2624700	because sometimes it's good to bring these things to light, even if it's not too much of a common occurrence on my channel.
2624700	2629700	I also want to give a big shoutout to my Patreons, thank you again, some of them are on screen right now,
2629700	2639700	you guys are great, thanks to my $50 Patreon, Sumhala Baloo, and my $200 Patreons, Brandon and Evening Steel,
2639700	2643700	your generosity is truly appreciated. Thank you guys very much.
2643700	2647700	I don't have too much else to add today, if you want to find me, you can reach me on Twitter,
2647700	2654700	at The Right Opinion, Facebook too, Discord as well, I'm fairly accessible, I like to think so at least,
2654700	2659700	but other than that, I don't really have too much else to say, so I guess I'll just leave it here.
2659700	2662700	I'm The Right Opinion, and I'll see you in the next one.
2673700	2685700	Thanks for watching!
