start	end	text
0	13700	Hello ladies and gentlemen, and welcome to The Right Opinion, the home of a twat with too much free time.
13700	20500	And I like video games. In fact, back in the day, I used to be a big gamer. However, contrary to the slogan,
20500	25500	which I pretty much retain for branding purposes at this point, I do not have much free time, and therefore,
25500	30700	I do not play as many video games as I'd like. One of the games, or series of games, I've always wanted to play,
30700	37000	but never quite got round to was Fallout. It seems like a fascinating concept, the dystopian, open world adventure
37000	42800	really captures my attention. Fallout as a game series has been going on for a few decades, and with critical
42800	48600	acclaim and popularity, it quickly obtained a substantial fan base which spilled over into the internet gaming
48600	53100	scene, and launched the careers of a lot of creators. It's not just the gameplay of Fallout that seems to attract
53100	57700	a lot of attention, but it's also the lore, the stories, and the mystery, in a way. When playing games,
57700	62900	we might experience something that provokes a question in our head, makes us think, I wonder what the story is
62900	68000	behind them. And like creators who delve into the mysteries of the internet, for example, the gaming equivalent
68000	72700	of these creators gain prominence with the same sort of approach, talking about the mysterious backgrounds
72700	78500	of some characters, and out of the roots came a YouTuber known as Oxhorn, the Fallout lore investigator
78500	84200	with a creamy voice. His videos delving into various cases, stories, and features, most prominently gained
84200	90700	traction over the 2017-2018 period. Now this wasn't Oxhorn's first venture on the platform, in fact he is
90700	95300	one of the older creators as the platform's history goes, prior to the Oxhorn channel he had a channel
95300	100700	named Oxhorn Movies, in which he uploaded World of Warcraft related content, which was certainly interesting
100700	101900	to say the least.
101900	117900	This has 17 million views by the way, good luck ever obtaining that sort of success with this sort of content.
117900	123400	He made the comment that he started making movies in around 2004, and therefore he must have pre-existed
123400	129200	the platform with his interests, however in 2013 he decided it was time to move on from this brand of content
129200	135000	and into other ventures. He had a podcast that he called Scotch and Smoke Rings, he also had a website
135000	141500	where he advertised beard care, grow a beard now, and he had his own personal blog, bloggingwithclass.com.
141500	146600	Now when someone's on the internet for such a long time, it's natural that they've probably got a lot of history,
146600	152000	a lot of pages up there that documents their journey, however sometimes when we look over a person's journey,
152000	157000	we see a few potholes they may have encountered, and we want to know how they would address it.
157000	162400	These are two separate processes that can definitely shape the perception of a creator and the possible implications
162400	168300	regarding their reputation. There's a lot more to the drama than meets the eye, but I found myself being contacted
168300	173700	a lot about this, and I was to be honest quite confused, because drama has a rather straightforward formula,
173700	178500	one side presents their case, another side presents their case, and then the beleaguered, bewildered audience
178500	184300	try and pick a side on the basis of what truths they can hopefully take away, and this isn't anything particularly
184300	189600	huge on the surface. Why would people want me to do a video on this bloke, as far as I could see,
189600	193900	a fairly inoffensive fallout channel that isn't pulling so many views these days?
193900	199100	Well when I began to spend more time researching content and watching the videos on it, I very quickly realised
199100	203300	why people were messaging me, because the truths that I just spoke about, they're not really clear.
203300	207700	The videos on him were long, I mean very long, and some of you creators clearly didn't get the memo,
207700	212500	because only I'm allowed to do long videos with pretentious rants, but I watched them because the right opinion
212500	218300	is a trooper, out on the front lines, watching the videos, so you don't have to. But now we've set the scene,
218300	224100	I want to lay out the situation, because I know a lot of you guys will probably not have a clue what I'm talking about.
224100	226900	Don't worry, Papa James is here to enlighten you.
226900	233700	So Oxhorn has appeared to have been embroiled in drama over a rather murky time period, at first it appeared to just be
233700	238700	criticism of his content and some of the coverage of Fallout games, but his response to this criticism,
238700	243900	which we'll get into in a moment, appeared to rub people the wrong way, and what happens is what you'd expect,
243900	247700	he made a few enemies, and internet history and enemies don't go too well.
247700	252900	What these people found was his blog, which had some fairly questionable views and propaganda published,
252900	258900	they found some of his old tweets, some articles that he had written himself on various matters, including homosexuality,
258900	265100	and on top of this they found other videos that showed him not quite as the sort of person he presents himself today.
265100	271100	This was piled alongside what many thought was his biased coverage of games such as Fallout 76 and Fallout 4,
271100	275300	and that led to suspicions of whether he had ulterior motives for supporting it.
275300	279700	On the surface, it created the narrative that he might be a homophobe with a bad taste in games,
279700	285700	but digging deeper, some people felt it made much of his content disingenuous, and that he was just an opportunist,
285700	290300	espousing the views that got him the ad rev. At first there was little public response from Oxhorn,
290300	295700	however, as the pressure continued to melt, and people began to question whether he still held some of his positions,
295700	301300	he decided to upload a public response, replying to the allegations, and going on the counter on many points,
301300	307500	claiming that his critics were mostly bad faith actors obsessed with bringing a harmless guy who made a few mistakes down.
307500	312300	This was met with support from many viewers who praised him for his calm, collected response to criticism,
312300	316100	however, there were still a sect of people who were unconvinced about his response,
316100	320500	and claimed that actually he had a habit of being quite authoritarian towards criticism,
320500	324700	and actually had not just taken down videos, but whole channels over this matter,
324700	328500	pretty much attempting to erase the history of his questionable behaviour.
328500	335100	This is a lot to digest, and honestly, the journey through the drama is one like a huge rollercoaster,
335100	338500	and if you get to a point in my video where you think you know which side I'm gonna take,
338500	340300	I might suggest staying a little longer.
340300	344300	But to do that, I think we need to get back into the right style.
345300	348300	Are you ready? Let's go.
357300	361100	I'm going to preface this by saying I'm not going to talk about Fallout a lot,
361100	366300	because it's not my main area of expertise, and frankly there is so much discussion on it already.
366300	370100	No, what I'm going to do is break down this drama into the section of allegations,
370100	373900	starting with the stuff that I don't think is really the strongest, but the oldest,
373900	376900	and you'll understand why I do that by the end of this part.
376900	380500	As mentioned, when you've been on the internet for a long time like Oxhorn,
380500	383900	chances are you've said some things that you wouldn't say in the present day.
383900	389500	This may be due to a change in ideology, or just the acknowledgement that it's inappropriate for your current format.
389500	394300	This recently came about with his blog posts, a few topics stuck out, firstly about porn,
394300	398300	secondly about homosexuality, and thirdly about substances.
398300	403300	Now, Oxhorn at the time of these posts, by the looks of it, was a person who was pretty invested in Christianity,
403300	409900	however, he takes a sort of Shapiro approach, doesn't really use the God said so, and tries to find some logical explanation.
409900	415700	In this instance, some of the bases of his arguments are applied through the perspective of prevention of societal decay,
415700	421700	and others are applied through Darwinism, and used to explain why the behaviour is immoral or undesirable,
421700	424100	as it's not evolutionarily preferable.
424500	436500	Anyway, so that, from a Darwinistic perspective, from the perspective of an animal that has evolved from the protozoa,
436500	442500	or whatever, to the creature that stands before you naked and shivering now, the man,
442500	448500	that is a man who has failed at being an animal.
448500	455500	Animals don't run around and look at other naked animals and get their jollies that way, they really don't.
455500	464500	That's really something that is only in mankind, you know, you don't see nude badger periodicals in the bookstore,
464500	472500	you don't, I mean that's just weird, you're not gonna find badgers lined up to buy the latest edition of Badger Boy, or whatever, Play Badger.
472500	476100	I mean, primates can masturbate too mate, but I wouldn't go too far into that.
476100	482100	The content criticizing homosexuality was written over a decade ago on Camera Of Truth on Blogspot,
482100	485700	where he basically posted articles that read like Craigoyou transcripts.
485700	492100	The other content was published around 2013 time in Oxhorn's very quaintly named Manly Festo,
492100	500100	which appears to be a guide on how to behave with class, like Oxhorn of course, he was the embodiment of a refined gentleman.
500100	505900	Now I'm being quite jovial about this because I find it quite funny, not gonna lie, maybe it's just the sentiment of it,
505900	514500	that there is this guru of class passing on his wisdom to the on-looking plebeians, such as thou shalt not beat their meat,
514500	517900	but I'll put this on hold to go to the homosexuality point.
517900	522900	So he wrote a few posts back in the day about homosexuality, I found them quite amusing,
522900	530300	but the central tone is that homosexuality is immoral, and if society deems it immoral, then they can discriminate it on the basis of morality.
530300	537100	This led to claims that he held outdated, bigoted views, he also tweeted out some articles and responses on his twitter at the time.
537100	540300	I'm not here to debate it, because he's already retracted it.
540300	545700	The thing is, although he comes across as rather self-righteous, it's easy to forget that gay marriage,
545700	551700	and even remote acceptance of homosexual relationships has only really become mainstream in the last few years,
551700	558900	and therefore I don't think it's really a thing worth exposing someone over, because it wasn't an uncommon belief back then,
558900	561900	especially if you've been raised in a very restrictive environment.
561900	567700	With that said, I think people who may feel alienated by such views can take up their concern with him,
567700	571700	and he can explain how he feels today, a bridge we will cross soon.
571700	576100	The whole porn and substances thing led to a lot of allegations that he was hypocritical,
576100	580100	the porn thing because he has mods that enable nudity in his Fallout games,
580100	590700	and his comments on substances because he is a frequent drinker and smoker.
590700	595900	Now, as far as the porn goes, I mean he did kinda qualify his statements a few years back.
595900	603700	There are people in real life who do get sex, and still watch pornography and masturbate,
603700	610700	but that's for a different discussion, we're not talking about sex in general, we're talking about satisfying sex,
610700	613700	and I get that into the article when we talk about marriage.
613700	619700	And it's hard to say if they're completely equivalent, although it's still a bit strange given his dispositions,
619700	621700	he does comment on it in his response video.
621700	627700	As for the comments on substances, although fairly disagreeable for myself, it's a case of what society has constructed,
627700	632700	and a lot of Oxhorn's views are clearly rooted in traditionalism of what is best for society,
632700	637700	and a lot of the substances that Oxhorn frowns upon are those ones that are classically ostracised,
637700	640700	for reasons some more rational than others.
640700	644700	It's not exactly hypocritical to decry them, as snobbish as it might seem.
644700	650700	Now, what his reasoning for sacrificing these views over the last year, we've heard a few responses from him,
650700	652700	in his response video that we'll break down later.
652700	659700	This moment changed many beliefs that I held. After all, if I could have been so wrong about homosexuality,
659700	664700	I could be just as wrong about the politics that I held, and my views on other social issues,
664700	673700	making nearly everything that I wrote in my 20s and early 30s outdated, and not an accurate representation of the person I am today.
673700	677700	And people can say that he's being disingenuous, and that he's afraid of losing fans,
677700	682700	but as it stands currently, I could not say for certain that those were his motives,
682700	688700	and although I do find the posts amusing, I wouldn't advocate dragging someone over them if they have expressed regret for them,
688700	691700	those were his opinions, he doesn't hold them anymore.
691700	697700	At the end of the day, when I'm doing any sort of activist work, my ultimate goal would be to convince people to change,
697700	702700	and if he's outwardly changed his views, then that at least is a message that he's conveying to his audience,
702700	704700	and that's a positive at least.
704700	709700	There was also a lot of criticism that he shills for Bethesda, basically, due to some misinformation in his videos,
709700	713700	particularly in the fact that he was defending Fallout 4 and even 76.
713700	718700	As said, I can't really comment on it, there's not really much that can be proved either way,
718700	720700	we don't have any bank receipts, unfortunately.
720700	724700	He might have his reasons for supporting it, but it's not the central issue here.
724700	728700	There were also some people criticizing him for not making a video unprovoked,
728700	731700	having to receive all these allegations to actually respond,
731700	737700	and although I do understand that perspective, it would seem weird to me to make a video unprovoked on previous views,
737700	739700	if no one was really thinking about them.
739700	743700	I think many people have had views they don't stand by in the past,
743700	747700	however, they were published online, so I do understand that perspective.
747700	753700	If I was in his position, I would have just released a public statement on Twitter or the community tab when they first arose,
753700	755700	just got something out there.
755700	759700	But when something was going as public as it was for him, a video must kinda come into play,
759700	761700	even if it was left a bit too late.
761700	768700	I think the purpose of a video at that point would be, if done right, to make sure that the other perspectives don't outshine his own,
768700	773700	because these criticisms were gaining traction and people wanna know if he genuinely still held those views.
773700	778700	There was also an old video going round of him allegedly fat shaming someone with quote,
778700	783700	too much personality, a rather mean-spirited video in which he mocked someone purchasing some food.
783700	788700	The video was around 6 years old and posted onto his YouTube channel, and he was revealing stick for this as well.
789700	792700	This is what happens when you have too much personality.
794700	800700	The reason that I've covered these topics from earlier on in his career are because these are things that could easily be quashed.
800700	804700	If these were the only claims, then his response would be straightforward.
804700	809700	He's a changed man, he realises the errors of his ways, and he won't be doing it again.
809700	813700	And in a way, that did happen, but it was missing some details.
813700	815700	So let's discuss his response.
819700	823700	So the first thing that Oxhorn did was remove the incriminating evidence.
823700	829700	Now, on principle, that is the right thing to do, as keeping them up can be seen as an implicit endorsement,
829700	835700	and when some people started criticising him for it, some fans and their defences of him were mildly concerning.
835700	839700	Why would I be scared of a faggot, boo motherfucker?
839700	844700	If you don't have the same ideology, you wouldn't want it spreading, or providing the impression that you think that way.
844700	850700	However, as I'm sure many of you know, these articles are typically archived by people, so the information is still out there.
850700	855700	However, for his domain, which contained his manifesto, I went to search it up, as you do,
855700	860700	and he actually placed a special request with the web archives to make sure you couldn't archive it,
860700	863700	which is admittedly a bit of a weird move.
863700	868700	I mean, alright, you don't want something out there, but as long as people already have screenshots,
868700	875700	it seems strange that you would try and completely bury its existence, especially when it was just a fraction of the criticism.
875700	880700	It does make you wonder what else was on there, but I digress, we cannot prove anything.
880700	886700	However, with the existence of questions surrounding his mentality, it made sense that he'd finally do a video addressing these claims.
886700	892700	As mentioned, it should have been a fairly simple dispatch of various points against him, and the comprehension that your positions have changed,
892700	894700	and on first glance, the video does that.
894700	899700	When I watched it first, I was pretty much done with the drama, and it seems many commenters would want over too,
899700	902700	but when I returned one more time, things didn't seem quite right.
902700	907700	I mean, he deals with the previous positions on homosexuality fairly reasonably, as mentioned,
907700	911700	although he could have dealt with it sooner, placed an explanation in somewhere,
911700	915700	not doing so doesn't make him a bad person if he considered those views in the past,
915700	921700	and given the very rapid expansion of his YouTube channel, he might just not really want to bring attention to it.
921700	924700	So with that one out the way, suddenly, something clicked.
952700	957700	Some viewers told me that this wasn't very kind, and upon reflection I agreed, and so I deleted the video.
957700	964700	It got only a handful of views before I deleted it, but as is the nature of the internet, nothing ever truly disappears from the internet,
964700	968700	and so trolls have dug up this very old video in an attempt to harm me.
968700	972700	Ok, but that's almost completely false.
972700	975700	There have been claims about the girl's age, but that's not verifiable.
975700	980700	What we do know is that this video was uploaded to YouTube and quickly became one of his most viewed videos at the time,
980700	983700	and was still up on his channel after three days.
983700	988700	This is not ambiguous, this is archived, which makes me wonder if he knew it was archived.
988700	993700	And sure, people confuse details, when you're making comments as if they're solidified responses,
993700	997700	and playing it down as if that's a defence, then you cannot allow for that.
997700	1004700	It's also noteworthy that all the details that Oxhorn gets wrong are details that would immediately play down the severity of such incidents,
1004700	1009700	and honestly, there is an inkling of suspicion in me that he does actually know how the incident went down.
1009700	1013700	The only thing that completely bewilders me is why on earth would he lie about it?
1013700	1018700	As far as I can tell, even if what he did has stayed up for a year and got 50,000 views,
1018700	1022700	an apology would have perfectly quelled any irritation that people felt about the incident.
1022700	1026700	It seems like a way to frame his mentality as impulsive, rather than what it actually was.
1026700	1030700	You can regret mentalities, you don't have to bend the truth.
1030700	1034700	On top of this, prior to the video, when asked about it in his Discord, he said it was a Twitter video.
1034700	1037700	Is he trolling? This is a bruh moment.
1038700	1043700	Alright, so that was a bit of a strange explanation, it had my suspicions raised a little, but life goes on.
1043700	1046700	Can't just throw someone to the dogs for a little misinformation.
1046700	1051700	He then launches into this attack against the people who have been trying to fabricate the claims against him,
1051700	1053700	some very malicious actors by the looks of it.
1068700	1071700	And then tried to spread around as if I had actually said it.
1071700	1076700	Another guy fabricated a conversation between himself and another big YouTube channel
1076700	1079700	using the inspect element option of Google Chrome.
1079700	1086700	He was able to just swap out the HTML to have the other YouTube channel say whatever he wanted that YouTube channel to say.
1086700	1093700	In this way, he started creating screenshots, spreading lies saying that this YouTube channel was working on a hit piece against me,
1093700	1096700	and that I had tried to bribe him to not publish that video.
1096700	1102700	These are all lies, and this particular user was even punished by the other members of his Discord server for lying to them.
1102700	1110700	But even though they know that it was a lie, this hasn't stopped other YouTubers from creating video content about these lies as if they could be true.
1110700	1112700	That's just the way many of these trolls are.
1112700	1117700	They'll use homosexuality and misogyny as weaponized tools to attack another person,
1117700	1123700	but when they're alone, their everyday conversations are rife with racism, sexism, and homophobia.
1123700	1127700	These organized attacks have taken a number of forms over the past few months.
1127700	1131700	The original Discord server where much of this went on collapsed due to internal struggles,
1131700	1135700	and so they've taken up a bunch of other Discord servers where the exact same thing is going on.
1135700	1140700	It's an organized campaign to try and spin a story that puts me in a negative light.
1140700	1144700	He basically suggests this encompasses the sort of toxic mentality against him,
1144700	1151700	and although I would certainly agree that those people engaging in such behaviour shouldn't be empowered in any sort of way whatsoever,
1151700	1154700	it's also important to look at the criticism and how it might have arisen.
1154700	1157700	Oxhorn says he doesn't have any sort of problem with fair criticism.
1157700	1160700	And people are free to disagree with me about lore.
1160700	1165700	I'll even hop into the comments section and have vigorous debates with people about specific lore topics.
1165700	1169700	As long as everyone is respectful and kind to each other, these can turn into wonderful conversations.
1169700	1172700	And I would say, this has been plaguing a lot of videos I've seen on him.
1172700	1176700	They're all just loaded with the fact that these people do not like Oxhorn,
1176700	1181700	and if you, as a YouTuber, believe he's manipulating his audience into thinking you're inherently toxic,
1181700	1184700	you really want to make sure those videos don't come across that way.
1184700	1190700	Fans will always go into the innocent until proven guilty mindset, even more strongly than most people,
1190700	1194700	and therefore, you have to put forward a decent case without going into too many ad hominems,
1194700	1196700	even if it's something that lights a fire on you.
1196700	1200700	That's just a side note, and one that I'd try and keep in mind for the future.
1200700	1204700	With that said, even though I don't think they were presented correctly,
1204700	1210700	I wouldn't brand all those who have criticized him as, quote, trolls, and we'll continue that lie of discussion in a moment.
1210700	1212700	Let's continue to watch this.
1212700	1216700	There was one time, for example, when I was doing a video on the Sunset's Hasperilla headquarters,
1216700	1220700	where I saw a Brotherhood of Steel decal on a manila envelope,
1220700	1223700	and I didn't realize at the time that it came from one of my mods.
1223700	1227700	Instead, I assumed that Obsidian had just reused assets from Fallout 3.
1227700	1231700	Obsidian did reuse assets from Fallout 3, they reused a ton of assets.
1231700	1236700	If you go into Michelangelo's sign shop, for example, we find signs from the Capital Wasteland,
1236700	1239700	that should not be in New Vegas at all.
1239700	1243700	However, once viewers made me aware that it was a mod, I immediately went into the comment section
1243700	1247700	and posted a comment correcting my mistake, and I pinned it to the top of the comment section.
