start	end	text
1247700	1252700	Alright, so this is referring to the criticism that he was just looking to hate on Obsidian,
1252700	1257700	thus shilling for Bethesda, and although he admits he was wrong about the certain detail,
1257700	1260700	it seems he didn't immediately change it like he said,
1260700	1264700	although it might look like that, you can see that the pinned comment has been quote edited,
1264700	1268700	now people edit pinned comments all the time, I do, that's not a big deal,
1268700	1274700	but that also doesn't mean that the comment was posted immediately before any of these videos at all.
1274700	1277700	There's a screenshot of him replying, dude wow, just wow,
1277700	1282700	in a rather condescending tone to someone who brings this up, which once again makes you wonder.
1282700	1286700	With that said, a majority of his other responses are fairly straightforward,
1286700	1291700	they're mostly relating to Fallout, and I do think a lot of the allegations he received on that front
1291700	1296700	were fairly difficult to really do anything about, and therefore not really worth their weight in discussion.
1296700	1299700	However, he does end the video on a bit of a strange note.
1299700	1305700	I'm publishing this video because people have asked why they've been seeing a flurry of anti-oxhorn videos
1305700	1309700	recommended to them on YouTube, and it's because I'm under a coordinated attack
1309700	1312700	from people who are trying to punish me for playing Fallout 76.
1312700	1325700	Well don't worry Oxhorn, I don't give a shit about Fallout 76, let's talk about what I do give a shit about.
1337700	1340700	The thing is, although his response sufficed for many people,
1340700	1345700	some felt like he had omitted certain details, he does address them in a pinned comment eventually,
1345700	1349700	but let's discuss the accusations first and then bring it back to that.
1349700	1353700	People have been making videos on Oxhorn for a while, and on principle that's unsurprising,
1353700	1359700	if you're a large creator with some hot opinions and dirty laundry, then yes, people are gonna wanna talk about it,
1359700	1362700	and when I watched some of these videos on him, I wasn't particularly compelled,
1362700	1368700	like as far as I could tell, they were the sort of small YouTuber content that you will find on anyone.
1368700	1378700	I doubt your wife would be okay with you using thumbnails like this, or like this, or like this, or even this one.
1378700	1384700	Oxhorn has stated in his videos to not give in to vices, all while smoking and drinking scotch,
1384700	1396700	but it is easy to let it slide strictly because most people usually don't consider alcohol or smoking to be a drug.
1396700	1401700	I mean, it's not the most persuasive stuff, and as a large YouTuber, it is fairly harmless,
1401700	1406700	which is why it's confusing that Oxhorn has allegedly taken such a hard-line stance against it.
1406700	1412700	There are multiple creators who have come forward claiming that Oxhorn has placed community and or copyright strikes against their videos,
1412700	1416700	and on top of that, has been silencing criticism over this in his comment sections.
1416700	1422700	The first discussed case is the one relating to a YouTuber by the name of Logical Underscore Fallacy,
1422700	1427700	now named Thomas Beckett. He made a video in response to Oxhorn's video defending Fallout 4.
1427700	1434700	As an outsider, it was a fairly confusing video with melodramatic rhetoric that didn't quite feel like it had earned its tone.
1434700	1439700	Maybe Oxhorn could ban me from his channel, but he cannot ban the truth.
1439700	1445700	And this is a new year, this is the year 2018, and this is the year that we fight back.
1445700	1450700	This is the year that we take a stand against frauds like Oxhorn.
1450700	1455700	As said, it's a video by a very small YouTuber that shouldn't really have too much of an impact,
1455700	1461700	and yet surprisingly enough, he was given a community strike for bullying, which is rather bizarre.
1461700	1467700	What is even stranger is then that his channel was taken down despite supposedly not having any additional content on the matter,
1467700	1473700	and with Logical receiving no further information than these emails, which attributed the removal to Oxhorn's complaints.
1473700	1479700	Now, it seems strange to me, personally, that YouTube would actually disclose the plaintiff, so I sought verification of this.
1479700	1484700	Now, I did speak to Logical, to see if he still had a copy of the email, which he said he didn't.
1484700	1488700	But not deterred, I decided to reach out to YouTube, and although they were hesitant at first,
1488700	1492700	once I told them I had permission from the owner, and it was pretty much all public,
1492700	1496700	they did confirm it was legit, so it's not looking good for our friend Brandon here.
1496700	1500700	However, I do say that with the reservation, that in their first response to me,
1500700	1506700	they say they don't typically name people who report other creators, so maybe the guy responding is confused here, I don't know.
1506700	1509700	I'll let you make your own conclusions regardless.
1509700	1513700	One thing that I would say is that, in Oxhorn's response, in his pinned comment,
1513700	1517700	he showed a general ignorance of the reliability of YouTube's system.
1517700	1522700	At the end of the day, we're not trying to necessarily make the judgement of whether the report was right or wrong,
1522700	1525700	we're trying to work out whether this was in good or bad faith.
1525700	1528700	And then we have to discuss the copyright system.
1528700	1532700	Now, Oxhorn has made a flurry of copyright claims in the last few years,
1532700	1538700	most of them on re-uploads of clips, and although I don't necessarily agree with preventing people from being able to see these clips,
1538700	1542700	see my video on Pokimane for that, he's still within his right to take them down.
1542700	1547700	However, one situation stood out, this is one with a creator named Sinon Mercer.
1547700	1550700	Now, he posted two re-uploads of certain clips onto his channel,
1550700	1553700	Oxhorn decided that he was going to get these videos removed,
1553700	1559700	but rather than just claiming them like many YouTubers do, he filed straight up DMCA takedowns,
1559700	1561700	which deals one strike per video.
1561700	1567700	Now, as said, he is in his right to do this, but it's pretty aggressive, and gives them much less channel mobility,
1567700	1572700	but maybe he just perceived the uploader as having ill intent against him, and therefore it was warranted.
1572700	1578700	So, clearly annoyed at receiving two strikes, Sinon then uploads a more regular quote exposed video.
1578700	1581700	As expected, it's not quite a content cop.
1581700	1587700	What I find ironic about the whole thing, though, is that a real man would admit and fix his mistakes,
1587700	1593700	which Oxhorn doesn't do, despite him claiming that he's so manly.
1593700	1597700	And what Oxhorn does is he goes in for the kill, he files a third takedown notice,
1597700	1600700	that would have terminated Sinon's account altogether.
1600700	1606700	Now, fortunately, through some miracle, YouTube actually intervened and stated that it was fair use,
1606700	1609700	which given how broken the system is, is almost incredible.
1609700	1612700	And with this, Oxhorn had fucked up, big time in fact.
1612700	1619700	Out of anything worth quote exposing him over, this is the closest you get to affirmation that he has the ability to be malicious.
1619700	1624700	Now, Oxhorn did not address this in the video, but he did respond to this in the pinned comment.
1624700	1629700	After stating that all critical channels on him are still up, which is a strange thing to say on principle,
1629700	1635700	because you'll only be able to see the channels that are still up, he then speaks about this specific situation relating to Sinon.
1636700	1641700	He states that the reason he made the stripe was because the video included the use of an animated short
1641700	1647700	that completely removed any real reason to watch his own video because it used the content in almost all its entirety,
1647700	1654700	and it was fine anyhow because YouTube saved him, and therefore he didn't necessarily need to look up the legality himself.
1654700	1658700	So I watched Sinon's video, and surprise surprise, Oxhorn's statement on it is false.
1658700	1664700	In Sinon's video, the animated clip that he uses is just over a minute out of the video which is 8 minutes long,
1664700	1672700	and ironically enough, uploaded in its entirety on someone else's channel where it's been for the last 10 years.
1672700	1677700	And to add insult to this injury, in the complaint that YouTube intervened in,
1677700	1683700	Oxhorn gave different timestamps which didn't even match where Sinon used the animated short in his video,
1683700	1687700	the clip he was complaining about was one where he was just talking in front of a camera.
1687700	1692700	I feel that a defence from Oxhorn is rooted in the point of view that you would have to be pretty petty
1692700	1699700	to go after this sort of exposed video that used information from other exposed videos and was recorded on a potato.
1699700	1704700	He clearly watched it all through, he is reaching Keemstar levels of obsessed.
1704700	1710700	I could barely get through 10 minutes of that video, it seems almost unbelievable, but he clearly did.
1710700	1716700	His point of view is also mixed with the idea that YouTube's system is just working fine and therefore it's not a big deal.
1716700	1720700	Nothing bad happened, even though his strike could have led to channel deletion.
1720700	1726700	The system is completely dysfunctional, and this has been broken for ages, even PewDiePie has been struck,
1726700	1733700	and YouTube didn't magically detect it, and this has happened again and again, anyone in commentary knows this.
1733700	1738700	The difference is when larger channels are struck, they can stand up for themselves, smaller channels don't have that,
1738700	1744700	and someone like Sinon would have never got their channel back, and that whole attempt to strike was reckless at best.
1744700	1748700	It makes the narrative that he'd do that to another channel much more plausible,
1748700	1753700	and his retrospective framing of the situation is misleading, more than forgetfulness can explain.
1753700	1755700	And speaking of misleading,
1757700	1763700	a lot of videos that have attacked Oxhorn have focused on a lot, which in my opinion is explainable,
1763700	1766700	even if Oxhorn himself has not explained them the best.
1766700	1772700	On principle, I don't think that someone should have their career ended for a load of old content that we've discussed today,
1772700	1775700	even if in hindsight it was done in rather poor taste.
1775700	1783700	There was a video uploaded called Defending Oxhorn, released by YouTuber Average Betas, who brand themselves as comedians.
1783700	1786700	Anyhow, in this one video, it is just a single bloke,
1786700	1790700	and throughout the first half of the video, he makes these sorts of defences that I've referred to,
1790700	1793700	and although I think they could have been a bit more well researched,
1793700	1798700	and people were giving him far too much credit for a line that was Jack from the Simpsons, I think.
1799700	1802700	Nobody's perfect, that's why they put erasers on pencils.
1802700	1806700	Everybody makes mistakes, that's why they put erasers on pencils.
1806700	1811700	His points weren't really that incorrect, that is until he gets to copyright,
1811700	1818700	and a lot of people have been going around citing this as a defence against the attacks that Oxhorn has been receiving,
1818700	1825700	and I don't think I can quite do justice for how bad I personally believe this next set of argumentation is,
1825700	1831700	so I think it's time to turn this into a little collab, and who else better served to cover this than my good friend, John Swan.
1831700	1834700	I suggest we bring him in, take it away my friend.
1834700	1838700	Hello ladies and gentlemen, and welcome to the writer pit- wait that is not the intro.
1838700	1844700	Hello everyone, Tro has asked me to cover this joke of a video, specifically the points relating to fair use.
1844700	1849700	I've studied copyright law quite extensively, so it's only fitting that the person who made this video,
1849700	1852700	Average Betas, starts off this section talking about copyright,
1852700	1860700	stating that he's not a lawyer, but that he can give a YouTuber's perspectives on the events surrounding Oxhorn and his copyright related incidents,
1860700	1863700	specifically on matters related to fair use.
1863700	1867700	Let's watch along and see what he has to say, I'm sure it's incredibly insightful.
1867700	1875700	However, I can speak from a YouTuber's perspective and give you what I know about striking channels, and what I know about fair use.
1875700	1879700	If for instance, someone steals my content and tries to pass it off as their own, then I can strike their channel.
1879700	1885700	If someone takes some of my paid content, like for instance something I put on Patreon, and they show it on their channel for free, I can strike their channel.
1885700	1890700	If a person takes private content of mine and shows it on their channel, I can strike their channel.
1890700	1894700	Wait, what? That's completely untrue.
1894700	1897700	Now, his language is a bit convoluted here.
1897700	1904700	He uses the word show, and doesn't specify whether this showing involves the content being used in an expose work of some kind,
1904700	1907700	or whether the content is just re-uploaded.
1907700	1914700	However, judging from statements further on in the video, I'm going to have to go with the conclusion that he means showing in any capacity whatsoever.
1914700	1917700	So, let's break this down.
1917700	1926700	He is very correct when he says that these cases are not necessarily against fair use, because these uses are definitely fair in many contexts.
1926700	1931700	But he's completely incorrect in stating that these uses are against YouTube's terms of service.
1931700	1937700	If we read YouTube's terms of service, we see nothing here relating to the topics which he has discussed.
1937700	1942700	But let's just say he made a mistake, and he meant to say the community guidelines terms.
1942700	1946700	But wait, nothing in there says anything about these topics either.
1946700	1951700	In fact, no document published by YouTube says anything about posting content behind a paywall,
1951700	1959700	or posting content that is not publicly available, aside from their copyright related documents, of which fair use is a valid defense.
1959700	1961700	Let's keep on watching here.
1980700	1982700	This is a major problem with these points.
1982700	1990700	I think average Batters is under the impression that content that is not published isn't protected by the same copyright laws as a published work,
1990700	1993700	in which case he would be unconditionally wrong.
1993700	2002700	Unpublished works hold the same copyright status as published works, and therefore are governed by the same fair use clauses as published works.
2002700	2007700	Furthermore, this has also been proved by multiple court cases on the subject.
2007700	2009700	He goes off on a similar tangent here.
2012700	2016700	...would be considered under copyright law, and are protected under fair use.
2016700	2020700	This means a private video of me at the beach with my family is not fair use.
2020700	2027700	Nor is any other private footage I don't make publicly available for entertainment consumption and copyright the works.
2027700	2032700	Just like how a deleted video on Facebook isn't under fair use, as far as I'm aware, I'm not a lawyer.
2032700	2034700	Yeah mate, we can easily tell that you're not a lawyer.
2034700	2036700	And again, completely incorrect.
2036700	2040700	And just shows how much this particular individual knows about fair use.
2040700	2044700	He didn't even bother to do a quick Google search to verify what he's talking about.
2044700	2048700	Another misinformed statement that completely manipulates the narrative is this one.
2048700	2055700	If I were to try to strike a channel that was using my content under fair use, or wasn't doing anything wrong,
2055700	2062700	and YouTube reviewed the strike and saw I was in the wrong, that I was falsely claiming something against that channel,
2062700	2064700	I would risk losing my channel.
2064700	2067700	This is, once again, completely incorrect.
2067700	2073700	To submit a DMCA strike on YouTube, you have to acknowledge that the strike is being made in good faith.
2073700	2079700	No one, aside from the individual who submitted the strike, could genuinely verify whether the strike was made in good faith,
2079700	2082700	especially when it is a grey area.
2082700	2088700	YouTube can't generally step in when strikes are made, since they have to maintain their Safe Harbor status.
2088700	2095700	Safe Harbor is a provision in US copyright law that states that services like YouTube are not legally responsible
2095700	2098700	for the uploading of unlicensed content by their users.
2098700	2103700	There have been circumstances where it was pretty easily determined that a strike was not made in good faith,
2103700	2109700	specifically if an account has been deemed as suspicious, however, for the most part, it doesn't occur.
2109700	2113700	Since it is difficult to tell whether a strike was made in good faith,
2113700	2117700	the channels that submit the strikes don't usually have consequences levelled against them,
2117700	2122700	and thus this claim, made by average batters, is a big stretch to say the least.
2122700	2127700	If someone posted a video about me and how they don't like my videos, then who cares, have at it, go nuts.
2127700	2130700	I just had at it. It was very entertaining.
2130700	2136700	Thank you for being a buffoon and gracing us with this discrepant conglomeration of Boulder Dash. Much appreciated.
2136700	2141700	Thank you so much, Jon. I hope he's cleared up any qualms that can be found in the video.
2141700	2147700	I'm going to leave his channel in the pinned comment, I'd definitely recommend checking his work out if you enjoy that sort of analysis,
2147700	2150700	though he needs to upload more, so make sure you go and let him know that.
2150700	2157700	To average batters, I apologise for Jon's butchering of your name, but you did butcher copyright law, so we'll consider it even.
2157700	2163700	However, with all this in mind, I want to begin to tie things up, though admittedly it's quite a lot to do.
2171700	2177700	In his response video, Oxhorn placed his critics into a collective who were all conspiring against him,
2177700	2181700	and although I would agree that some of these guys clearly have ties to each other,
2181700	2189700	I think they've more been united by their negative experiences with Oxhorn rather than being united prior to simulating negative experiences,
2189700	2193700	and maybe originally it was born out of his opinions on Fallout.
2193700	2199700	When you say something that is unpopular and kinda side him with the corporation, you're gonna get people who think you're shills,
2199700	2203700	and when watching some of the oldest videos on him, that's certainly how it comes across,
2203700	2209700	but eventually this manifested when people started to think that he'd overstepped his jurisdiction in responding to these,
2209700	2214700	and his attempt to finish off Simon Mercer's channel was probably where the cynicism peaked.
2214700	2220700	He really doesn't like people bringing attention to this stuff, and on principle, I get it, if you have something you're ashamed of,
2220700	2225700	then you don't want to be continuously dragged over it. Equally, you don't want people to look you up,
2225700	2230700	and that to be their first impression of you, you want them to be clear, that's not what you believe.
2230700	2234700	I think that's happened to a majority of creators on this platform, myself included,
2234700	2239700	but there's nothing you can really do than release a statement and roll with a few punches here and there.
2239700	2246700	There will be people with perceptions of you that aren't quite current or accurate, just make sure that doesn't become prevalent.
2246700	2252700	Twisting the truth in subsequent responses will inevitably come back to harm you because people will perceive it as dishonesty,
2252700	2257700	and trying to cover up these things makes people question if you really understand the gravity or the consequences,
2257700	2260700	or even feel remorse for them in the first place.
2260700	2265700	There's been a lot of evidence that Oxhorn is deleting comments on his newest video when people present counter-narratives,
2265700	2269700	such as the disparity between the YouTube comment count and Social Blade comment count,
2269700	2274700	as Social Blade updates after, implying that comments were being deleted post-publication,
2274700	2278700	even ones that seem reasonable, just coincidentally being against him.
2278700	2284700	Assumedly, a lot of people are being hidden from the channel too, and it seems he really wants to restrict the scope
2284700	2287700	of what's being said to those who are basically praising him.
2287700	2290700	And although it's his channel, he can do what he wants,
2290700	2295700	when you're so desperate to hide something rather than just making sure the public understand all the context,
2295700	2298700	people wonder what you've got to hide.
2298700	2304700	On top of this, there was another account that has been defending Oxhorn in comment sections named KK,
2304700	2308700	which was funnily enough created four days after the Oxhorn channel,
2308700	2313700	and it's only subscribed to him, with no other activity in the last eight years.
2313700	2317700	Although it's not impossible someone might have just come over from the Oxhorn Movies channel,
2317700	2321700	it is probably an alt. Loads of YouTubers set them up under brand accounts
2321700	2325700	because back in the day, it was an easy way to upvote videos in case they got bombed.
2325700	2330700	As a side note, can people start referencing in the description or the pinned comment?
2330700	2332700	Why did you put it on screen? Are you a boomer, mate?
2332700	2336700	I think Oxhorn, like some other creators I've encountered in the past,
2336700	2339700	really overestimate the sensitivity of an audience,
2339700	2344700	and just try and completely shield them from possible transgressions they may have committed.
2344700	2347700	It started as an attempt to remove some of the incriminating videos,
2347700	2350700	and it's clearly gone over the line,
2350700	2352700	and then when the videos became too much to handle,
2352700	2357700	he made a response video and a response comment where he somewhat addresses the claims,
2357700	2362700	but similarly downplays some and misrepresents others to preserve the image.
2362700	2366700	But I really think if he just said what had happened and just apologised,
2366700	2368700	then this wouldn't have prolonged any further.
2368700	2371700	Most audiences just want to enjoy the creators,
2371700	2374700	and be comfortable knowing they're supporting people who aren't terrible.
2374700	2379700	Most people's bars aren't that high for past political and moral standards,
2379700	2381700	especially if you're a Fallout YouTuber.
2381700	2386700	To add to this, I understand why there are a surprisingly high number of people who want me to cover this,
2386700	2389700	and I don't doubt they've probably reached out to get other creators as well,
2389700	2392700	but I think that people have been hesitant to pick this up
2392700	2396700	because a lot of the videos are hard to follow in exactly what they've been trying to say,
2396700	2400700	and bogged down in these sort of trivial points which tend to suppress the impact.
2400700	2404700	It's kinda allowed Oxhorn to jump on the narrative that these people are toxic,
2404700	2408700	and although some people clearly are, they're not without their legitimate criticisms,
2408700	2414700	and going as far as to end channels over it is quite ridiculous considering the quality of these videos in question.
2414700	2419700	I have a hunch if he'd never reacted in the first place, we wouldn't be sitting here having this discussion today.
2419700	2425700	And this isn't to say I think Oxhorn is a fantastic bloke who just needs a bit of good advice.
2425700	2429700	Some of his old articles could be somewhat reflective of a mentality he might still hold,
2429700	2432700	they come across as rather narcissistic,
2432700	2436700	and as someone who personally also deals with a bit too much narcissism from time to time,
2436700	2441700	I understand that you get the impression that people are completely out for you with bad intent,
2441700	2445700	and you just wanna wish they would shut up presenting this perspective which just isn't you anymore,
2445700	2448700	I completely get that, but Striking is not the answer,
2448700	2452700	you gotta channel that into something better and showing them that you are better than them.
2452700	2455700	Striking doesn't do that, it does completely the opposite,
2455700	2460700	and for what has been done, I would apologise and be grateful that you still have your channel,
2460700	2462700	but hey, that's just what I think.
2462700	2467700	Maybe it's not easy to have sympathy for people who you perceive as acting with ill intent.
