start	end	text
1845000	1852000	On the morning of September 26, 1983, people around the world woke up to an ordinary Monday.
1852000	1857000	Children went to school, and adults went to work, just like they did every week.
1857000	1868000	Just hours earlier, somewhere in a military bunker near Moscow, Stan Petrov correctly determined that the nuclear warning was a false alarm, and no nukes were launched that day.
1868000	1875000	Petrov deduced that if the US were to launch a real nuclear strike, they wouldn't launch just five missiles.
1875000	1882000	While you may think that this would have given Petrov an easy decision, you have to consider the absurdity of the situation.
1882000	1890000	I think there's an argument to be made that, for a very brief moment, Stan Petrov was the most powerful person in human history.
1890000	1902000	Most people would say that they enjoy power, but what they probably mean is that they enjoy power in the presence of agency.
1902000	1911000	Most of us have very little power and agency. We do what we can to get by and have practically no means of influencing the world around us.
1911000	1917000	When most people think of power, they think of kings and CEOs and international celebrities.
1917000	1923000	The very exclusive members of our society who have both great power and great agency.
1923000	1928000	When people dream, most of them imagine themselves in this position.
1928000	1935000	On the other hand, some people would be willing to relinquish the stressful responsibilities of power and keep the agency.
1935000	1942000	You see this in the cultural icons of the nomadic hippie, or the western outlaw, or some dude who wins the Powerball jackpot.
1942000	1949000	They generally get to do what they want, but rather than influence the world around them, they're just sort of along for the ride.
1949000	1956000	Stan Petrov found himself in the least desirable position of all, great power and little agency.
1956000	1963000	For a few moments, he and he alone controlled the fates of the 55,000 nuclear weapons on Earth,
1963000	1968000	enough firepower to wipe out a majority of the world population in a matter of hours.
1968000	1972000	He didn't get to control how the weapons were used or where they were headed.
1972000	1976000	Petrov's only say in the matter was whether or not they were launched.
1976000	1982000	Had Petrov reported the warning as an attack, it's unlikely that anybody would have challenged it,
1982000	1985000	especially considering the Cold War tensions at the time.
1985000	1990000	You could say that at any given time, the president has the same amount of power,
1990000	1997000	but nuclear launch protocol is configured with a system of checks and balances to prevent the president from firing nukes on a whim.
1997000	2001000	The difference with Stan Petrov is that he was the protocol.
2001000	2009000	Petrov's decision of whether or not to report the warning directly influenced the outcome of whether or not nuclear weapons were fired that day.
2014000	2017000	We can all look back on this event and call it an easy decision.
2017000	2023000	I'm sure if given the choice, most of us wouldn't choose to kill a majority of the world population.
2024000	2028000	But Stan Petrov didn't have the luxury of historical hindsight.
2028000	2035000	In the moment, he had no way of knowing for sure that his intuition was correct and that the satellite warning system was wrong.
2035000	2040000	Wrong. Answer his neck. 300 volts.
2043000	2052000	In 1961, psychologist Stanley Milgram found that more than 60% of people could be persuaded to administer a lethal electric shock
2052000	2055000	as long as they were under the instruction of an authority figure.
2055000	2061000	And the way I see it, ladies, you owe me for one jelly donut!
2061000	2069000	Think about basic military training and how soldiers are conditioned to blindly follow authority and remain loyal to their nation at all costs.
2069000	2072000	Soldiers are not trained to operate as individuals.
2072000	2081000	They are trained to function as an interchangeable part of a larger system, and any deviation from their assigned purpose is often unacceptable.
2081000	2087000	Had Petrov only followed his training, he would have trusted the warning system and reported a nuclear strike.
2087000	2094000	Had the Soviet military protocol functioned as intended, the world as we know it would have ceased to exist.
2094000	2100000	Only by deliberately disobeying the system could Stan Petrov make the correct decision.
2100000	2105000	I want you to imagine yourself, or the average person, in this situation.
2105000	2113000	The system in front of you is telling you that your homeland and everyone you know and love are under attack from your fiercest geopolitical rival
2113000	2117000	when you know that tensions between your nations are near an all-time high.
2117000	2123000	You have no way of defending yourself from the attack, but you have the power to bring justice to the people responsible.
2123000	2128000	There's no time to think it over. You must decide and you must act immediately.
2128000	2136000	How many of us would push the red button? How many of us would deliberately violate our training on a gut feeling that everything is okay?
2136000	2141000	I'd like to think that September 26, 1983 was our judgment day,
2141000	2149000	when one unsuspecting man was tasked with making a single decision that represented the culmination of millions of bad decisions before him.
2149000	2156000	Let us be grateful that, despite all of our sins, Stanislav Petrov chose wisely and spared us.
2159000	2168000	A few years later, the global nuclear arsenal peaked at more than 70,000 warheads.
2168000	2173000	In 1985, Mikhail Gorbachev assumed leadership of the Soviet Union.
2173000	2180000	His cordial relationship with Ronald Reagan would allow the nations to open up a new era of diplomacy.
2189000	2194000	There has been a nuclear accident in the Soviet Union and the Soviets have admitted that it happened.
2194000	2201000	In 1986, the Chernobyl nuclear power plant in Pripyat, Ukraine suffered a catastrophic meltdown,
2201000	2205000	leading to the deaths of more than 4,000 people from radiation sickness.
2205000	2211000	It would be the first widely publicized event showcasing the disastrous health effects of ionizing radiation.
2211000	2215000	Overnight, public opinion of nuclear power took a nosedive,
2215000	2220000	and the world powers finally began taking steps towards denuclearization.
2220000	2225000	In the next decade, nearly half of the world's nuclear warheads were disarmed.
2225000	2230000	Mr. Gorbachev, tear down this wall.
2230000	2245000	Thousands and thousands of West Germans come to make the point that the wall has suddenly become irrelevant.
2245000	2251000	In 1991, the Soviet Union officially dissolved, bringing an end to the Cold War.
2251000	2256000	Ever since then, the US has been trying to find the next incarnation of the evil empire.
2256000	2261000	The Cold War forged an attitude of paranoid discontent that hasn't really gone away.
2261000	2265000	Lately, many of us have given up trying to find a formidable foreign foe,
2265000	2271000	and we've instead shifted our attention within our own borders and turned much of the paranoia on ourselves.
2271000	2279000	The existential horror of day to day life in the Cold War has largely receded to nothing more than a relic in fictional entertainment.
2279000	2284000	Like I said at the beginning of this video, most of us can't handle the idea of mortality,
2284000	2287000	so we tend to not think about it very much.
2290000	2295000	The panic was palpable. Hawaiians rushing for cover under the threat of a missile attack.
2295000	2300000	This child was lowered into a manhole. Another family huddled in a closet.
2300000	2304000	5,500 people called Honolulu's 911 system.
2304000	2307000	You are the person who triggered the false alert.
2307000	2320000	Yes. Unfortunately, I'm really not to blame in this. It was a system failure, and I did what I was trained to do.
2328000	2332000	Petrov retired from the Soviet military a year after this incident.
2332000	2336000	He lived a quiet, uneventful life for the rest of his days.
2336000	2341000	The false alarm remained a secret for more than a decade. Not even Petrov's wife knew about it.
2341000	2348000	Years later, when news of the event reached the press, he cooperated with media interviews and even an independent film,
2348000	2351000	but remained humble and modest regardless.
2351000	2357000	Stanislav Petrov died on May 19, 2017, to almost no publicity.
2357000	2360000	The press didn't even report on it until September.
2360000	2367000	Possibly the most important person of the 20th century was so obscure that it took months before anyone even noticed he was gone.
2367000	2372000	Chances are, most of you watching have probably never heard of him before this.
2372000	2378000	Billions of people are alive today because of his choice, and the vast majority of them will never know his name.
2378000	2385000	I think it's somewhat fitting that most people will never know about him, because in that aspect, he was just like the rest of us.
2385000	2390000	And if Stan Petrov had mercy for the world, then maybe the rest of us can too.
2390000	2395000	Life is fragile, and it can be taken away from us in an instant.
2395000	2398000	None of us know how much time we have left.
2398000	2404000	How much of it will we waste fighting endless wars that no one will even remember 50 years from now?
2404000	2408000	I think we're far better off spending that time enjoying what we share in common.
2409000	2411000	Will we ever achieve world peace?
2411000	2415000	Or are we doomed to fight like the savage creatures from which we came?
2415000	2419000	Perhaps enlightenment will allow us to overcome our prejudice.
2419000	2423000	Or maybe ignorance will lead us to our blissful salvation.
2423000	2430000	Only time will tell, but at the very least, we can be thankful that Stan Petrov gave us the opportunity to find out.
2430000	2434000	So sit back, relax, and crack open a can of Coke.
2434000	2439000	Because if we're lucky, there will never ever have to be another man like him.
2464000	2478000	And I'd like to buy the world a Coke
2478000	2481000	And keep it company
2481000	2484000	It's the real thing
2484000	2488000	What the world wants today
2488000	2491000	It's the real thing
2491000	2495000	What the world wants today
2495000	2498000	It's the real thing
