start	end	text
1310920	1332840	Well, as said, throughout school, we were constantly warned of catfish. Adults posing as children on the internet to try and lure you in with their enticing life because they understood you, fellow kid. We were also taught about stranger danger, and how not just to go with anyone who said they'll give you a lift because they can give you a lollipop to suck on. A foreshadowing metaphor, I'm sure.
1332840	1360120	The point is, the Bud Day was neither of these. He was not someone who was offering children candy in the streets, not that we know of at least, nor was he posing as a child online. He was a fat, bold man, not the pinnacle of attraction, I certainly wouldn't tap that to say the least. However, he ended up in a position that many questionable people on the internet have ended up on themselves, many people who really should have no power considering that the person on the other side of the screen can just up and leave.
1360120	1382120	The Bud Day was an idiot, but he reflects a very overlooked trend on the internet, and that's one we can derive from real life. Over the last few years, we have seen the power structures amongst places like Hollywood gradually being taken apart, scandal after scandal after scandal, all reflecting a network that many people had been complicit in and enabled through the communities involved.
1382120	1398120	It was amazing, given how public these figures were, that everything was just swept under the rug to many people's ignorance. We had it in the UK too, individuals like Jimmy Savile, Rolf Harris, unbelievably public, went completely under the radar, despite some very obvious hints.
1398120	1411120	The thing is that this is what power does, it intimidates people, and the online world is creating new forms of these communities that no one seems to be ready to understand. Within these communities, like anything, you have hierarchies,
1411120	1419120	and children who want to be a part and want to join in, and they have people they admire, role models, who are more accessible, remember what I said earlier.
1419120	1426120	They are then put in a position where they are offered a chance to be a part of something, and if they don't, well then they won't know what they're missing out on.
1426120	1439120	And I understand that sounds completely bizarre, the fact that some kid with their whole lives ahead of them would somehow end up sending nudes to a 40 year old, but honestly, it's one of the biggest problems that I've found with younger individuals online, myself included,
1439120	1452120	is that they tend to have a very in-the-moment perspective. Looking back on my childhood, I can confidently say that barely anything that happened to me would have had a bearing on my opportunities right now, but back then it seemed make or break.
1452120	1459120	This is a chance to do something. If not, what will the consequences be? With this person and power, with this trusted figure.
1460120	1474120	The Bud-day was exposed because he didn't really have any of these. Everyone kind of assumed he was a creep because he behaved like one, but he still benefited from the position of power that almost gave him what he desired, and there are many people who have done it and got away with it, because of their clout.
1474120	1483120	Another real problem is the privacy that many of these sites generate. Many situations include people going to Snapchat, coercing what they need, and then nothing happened.
1483120	1494120	You used to have to be really wealthy and powerful to set up such twisted rings, but all you do nowadays is have a bit of internet clout and bobs your uncle. A creepy, not so young, but still your uncle nonetheless.
1494120	1503120	Everything is much more accessible, and given the fact that all some of these cretins demand are instant nudes over Snapchat, it might as well have never happened.
1503120	1508120	Power intimidates a lot of people, particularly children, and that was something that was never really acknowledged at my school.
1508120	1514120	Younger individuals need to acknowledge that these people don't need to have the influence over their lives if they don't want it to.
1514120	1523120	It's an uphill battle, but in my opinion, I think with the new creation of these online worlds, these are things that are more prevalent and more important to discuss than ever.
1523120	1533120	Even if I had to use bloody TikTok as a proxy to push that message, I don't think the solution is just to shut down these applications, because as I said, makes these incidents somewhat inevitable.
1533120	1540120	But working on awareness and actual information, rather than the classic school narrative of how computers melt your brain, might be useful.
1540120	1546120	Equally, as commentators and as compilation makers, I think about the narrative you're creating when dealing with these people.
1546120	1557120	I know that people didn't necessarily have proof that he was a creep before, and frankly, I doubt that'll change much given how faceless and lacking accountability a lot of these compilation creators are, but hey, what can you do?
1557120	1567120	To add to this, I'm not saying that people shouldn't make videos on these people, I'm not saying that they should be excluded, and I've never supported that, but make sure the framing is accurate,
1567120	1575120	and if you have a hunch that your video may bolster them, and they might be seedy, presenting them as merely some clumsy chump may not be a great idea.
1575120	1582120	The world is changing for everyone, and while the most recently observed problems specifically coming from a website like TikTok,
1582120	1594120	reflects a greater concern, and how illegalities, once restricted to the most privileged and most elite, are now increasingly accessible within the creation of communities of varying age, accessibility, and vulnerability.
1594120	1601120	The budday was an idiot, but not everyone is, and it's the ones who haven't been caught who are the ones we should be most worried about,
1601120	1610120	because there's something about the internet that just has a very unique group of people, and many of whom are quite vulnerable, and they need protection rather than exploitation.
1610120	1618120	There are many things the internet normalises, and TikTok can show that there are specific features that can end up supporting that inadvertently.
1618120	1627120	However, there are places that we can draw a line in, and remember that we can still hold these people to account, and make sure that they don't get away with it, just because they are on the internet,
1627120	1632120	and make sure that these situations are avoided, and cut down as soon as possible.
1632120	1638120	Is TikTok safe for children? Not entirely, but neither is Twitter, YouTube, or in fact 90% of websites.
1638120	1646120	Sure, there are definitely some things that definitely make TikTok more vulnerable as a platform, but we can acknowledge them, and we have to prepare ourselves for unsafe environments.
1646120	1655120	It's inevitability at this point, and most educational systems do a good job at this, but maybe this new narrative of power should be integrated more.
1655120	1663120	Maybe it has been already. I don't know, I'm no longer in school, thankfully. If I was, it would probably be a bit creepy.
1663120	1670120	What are your thoughts? Leave them in the comment section below, I would love to hear them. I'm an open guy, I tend to read the top set of comments for a bit,
1670120	1681120	and not in the comment section, you can reach me on Twitter, at TheRightOpinion, I have open DMs if you want to talk to me there, Discord too, hit me up, Facebook even, I use that.
1681120	1689120	See, I'm all on every site, apart from Instagram, not yet. I also want to give a big shoutout to my editors, who have once again done a fantastic job,
1690120	1697120	and to leave their links in the pinned comment, and you should definitely go and click them, check them out, send them some love, they really do deserve it, they are great people.
1697120	1705120	Great, great people. I love them a lot. Also want to give a big thanks to my Patrons, a few on the screen right now, they're in the pinned comment too, I love them a lot,
1705120	1714120	means a lot, and a personal thanks to Ryan, who is still being extremely generous, and I do not know why, but I'm very grateful of it. Thank you Ryan.
1714120	1722120	Anyhow, I don't have too much else to say, really much appreciated at recent, however until then, I'm TheRightOpinion, and I'll see you in the next one.
