start	end	text
0	10680	Hello ladies and gentlemen, and welcome to The Right Opinion, the home of a twat, with too much free time.
10680	17000	And honestly, on this channel, the topics we've covered of recent have been pretty serious in the grand scheme of YouTube things.
17000	23560	I like to be serious, I'm a serious, brooding person, I am the Batman of YouTube, minus the excessive riches.
23560	27400	So I thought, you know what, we'll do something more fun, something more upbeat,
27400	31400	something that the child-friendly twats at YouTube would endorse, TikTok.
31400	34920	I mean, what seriously can be said about that?
34920	39000	It'll get me rated E for every single little git who wants to click on my videos.
39000	42440	Yeah, I'm looking at you, you little scallywag, you're watching The Right Opinion now.
42440	48920	Yeah, today we're pulling out all the stops to get Susan's endorsement, and talking about, let's have a look.
50760	52120	Child predators.
52120	55320	Susan, I am so sorry, but I have a duty to serve.
55320	58920	One day I'll make content that will rival Jimmy Fallon in its inoffensiveness.
58920	63400	And honestly, I really did preside over this topic for a while, really considering whether I should do it.
63400	68040	TikTok is the peak of piss-take topics that anyone should be doing.
68040	74760	Everyone's been talking about it, but honestly, I think one of the incidents outlines a greater phenomenon of recent, the art of child predation.
74760	77920	I'll give you a brief rundown of TikTok for any boomers who are watching.
77920	82440	I love you all the same, don't worry, but all this new technology, it seems rather redundant to me as well.
82440	84280	But there's an audience, a large audience.
84280	92120	You know that old cliche where people grab the nearest microphone-shaped ornament, a hairbrush, a toothbrush, a dildo, you know, and they sing in the mirror?
92120	99240	Well, it appears it's not just some timely fad, it's clear there is some inner vanity that needs to be fulfilled, which is why these apps exist.
99240	105720	They are basically a virtual mirror for you to lip-sync your favourite music or weird quote, or whatever you want to do, or maybe a mix.
105720	112600	And admittedly, I am completely guilty of Snapchatting myself, lip-syncing desperately, and sending it to my friends, and probably confusing them greatly.
112600	115480	The difference is, I don't put it out for the world to see.
135720	141000	I thought this was forever, now it's way till the end
141000	142680	Well, there goes my integrity.
142680	152440	Anyhow, basically my point is that TikTok is a platform that remotes this on a public basis, so that every 13-year-old can post something, thinking they're all being hip, and then have it there for the rest of their lives,
152440	159160	so when they go into some job interview, they can have their ass torn apart by some manager who ain't googling their name and found this goldmine.
159160	163400	And they'll forever be known as TikTok Tim, because their name is Tim and they did TikTok.
163400	165880	I was rather specific, but my point still stands.
165880	176520	TikTok itself was founded initially in 2016, but it didn't start to pick up until a few months ago with the merger of one of its modern contemporaries, Musical.ly, which is another platform with a similar purpose.
176520	183160	However, TikTok seems to be even more prevalent than Musical.ly in this current environment, and there are many reasons for why that appears to be,
183160	191560	partly because of the absolute mammoth Chinese market, which is where it was originally launched in 2016, that has likely given it a lot of momentum.
191560	197240	But it also has additional features that definitely make it more extensive than previous applications,
197240	204680	as well as the fairly straightforward interface that does make creating the content for hyper-annoying children nice and easy, which is what we like.
204680	212600	I may be an old, jaded man at the age of 21, but I must say, when I was a lad around the young ages, I did not have many privileges of the internet.
212600	218360	I lived in the middle of nowhere, and the bandwidth wasn't that great. I remember a time when we used dial-up.
218360	229560	At then, we were witnessing a real movement, the creation of e-relationships, and I don't mean romantic relationships, though they definitely fall into this category,
229560	237560	but I'm talking about connections between people all over the world. The age of the internet is truly an exciting thing, with people being more interconnected than ever.
237560	244280	It has created its own culture in a way, and as someone who has benefited from that, there is no way I can ever not give it its kudos.
244360	250520	However, the online world also brought many threats, and one that I want to talk about today is that of predators.
250520	258760	Predators have always existed, they are nothing new, it's just the internet gives them a new dynamic to play with, and that means that we all have to be more aware,
258760	267480	and in all fairness, the education system in the UK was very proactive in making sure that we, as children, weren't roped into such things,
267480	276760	and although it's very easy to think to yourself that you won't end up in one of those situations, I mean, who would, nor would my parents have let me, I still did actually.
276760	285400	Admittedly, it wasn't through the internet, I don't think that would have happened, but my point is, there are still many people in different environments who are susceptible to that,
285400	292280	particularly when you have a rocky real-life relationship with those around you, and some stranger online offers you a better alternative.
292280	297960	Although it may seem absolutely insane to us, it sounds like a possible escape to a naive child.
297960	305400	These are the two issues that come to a head today, because TikTok, like many other online platforms that attracts large swathes of children,
305400	311960	has been facing down criticism for how much their application appears to promote an environment where child predators can thrive.
311960	318840	There have been a few instances, and suspicious activities, that have alerted people to the platform's fertile predatory grounds.
318840	327080	However, like many other questions facing down the internet, I feel that it's more complicated than it appears on the surface, and not just a case of TikTok bad,
327080	335080	particularly more deeply than it's been presented by other YouTubers, and make no mistake, I don't blame them, because it's very easy to say this is wrong,
335080	343800	and you know what, that's not incorrect either, but there are some deeper cultural discussions that are being placed aside for what I think could actually be quite a stimulating topic.
343880	353880	So today, come with me into TikTok, as we discuss the intricacies of living on the online world, and have a greater cultural discussion over the suitability of the internet for children,
353880	360440	and how this specifically plays into a situation with an application like TikTok, and ask ourselves, is it safe?
360440	368120	What can be done to prevent perverts from taking advantage of such an environment, and what can be done for children to prevent them from falling into these situations?
368120	369880	Are you ready? Let's go then.
373800	385960	Now, today's discussion has been provoked by one specific incident, and a flurry of additional things that have been observed by other YouTubers.
385960	394040	The main one involves a bloke called TheBudday, TheBudday, I don't know how to pronounce his name, frankly, he forfeits the right to be pronounced correctly.
394040	398680	I'm just gonna call him TheBudday, because that's what seems most comfortable to me.
398680	403880	Anyone using a name like that should have been spotted as a nonce from a mile away, but unfortunately, he wasn't.
403880	410760	And maybe the innocent until proven guilty narrative does prevail in these instances, as much as I like to judge people off their names.
410760	418680	Now, typically in the past, many of the world application stars of sites like Musical.ly and Vine have been vapid, young, annoying children,
418680	424520	and with TikTok, that hasn't really changed, but there is a new brand of celebrity that emerges from all these sites,
424520	429240	and one that is created much more regularly on TikTok, and that is the Ironic Star.
429240	436600	Now, the internet makes no secret of how it just decides to make the most random people famous, whether it was Ken Bone, Charles Ramsey, or so on,
436600	443080	but this is not the same. The Ironic Superstar is someone who does everything that the normal obnoxious child does,
443080	450920	but you see, they're an old, self-aware adult, so it's hilarious. Ha ha ha ha ha, how fucking funny.
451000	457560	Now, these people aren't overly prevalent on any platform. In fact, if you look at the most popular stars from all these applications,
457560	464520	they're almost all very young guys or girls, who probably should be in school, but hey, premature fame will do until they're addicted to drugs.
464520	468840	Wow, I'm in a really cynical mood today. They clearly aren't paying me enough to be nice.
468840	475080	Back to the point, young individuals tend to dominate most platforms, but you see, TikTok has this little mode known as duets,
475080	482360	where you, well, duet. Basically, someone uploads a hilarious version of them lip-syncing, and they can allow anyone to, quote, react to them,
482360	487160	and what this has done is spread a whole new genre, basically that being ironic TikToks.
487160	494600	In fact, there's a whole Twitter dedicated to just reposing these hilarious, ironic TikToks, and retweeting the moderator's garbage, too.
494600	500760	The ironic TikToks themselves will involve someone using the duet feature in a knee-slapping, self-aware way.
500840	511400	This has also yielded plenty of legendary memes, I use legendary very liberally, such as the Tracer meme, or the hit-or-miss meme, or both, together, because I hate you.
511400	531880	Bona-fide classics, I'm sure. Anyhow, this has amplified the market for ironic lads to gain power on the platform,
531880	539880	and one of them in this instance was The Badae, and he has been around. I'll tell you that much, pretty much everybody has been reacting to him,
539880	547160	because he is exceptionally creepy, but this is what happens with the reaction commentary genre, which has been expanding exponentially of recent.
547160	556600	It's an effect. The creepy old man on TikTok has almost become its own market. People laugh and react to these people, and they get lots of views, because audiences love these things.
556600	567320	It's pathetic, but we love laughing at things that make us feel better about ourselves, so we give it a platform, and then we inadvertently promote it without necessarily decrying it, merely deriding it,
567320	578360	and there is a difference between those two presentations. And I'm not saying I don't understand why it's done, it is hilarious, but the problem with laughing at people like that and giving them an audience is that you subsequently give them power.
578360	585640	However, the main reason that people gave The Badae power in this instance is because people presented them as they were. What do I mean?
585640	592280	Ben Shapiro, for example, now people can completely disagree with PewDiePie promoting him, given the fact that he does have some views that are rather disagreeable,
592280	603400	but the truth of the matter is, it's unlikely that Ben is going to gain any additional significant following from the instant, because the way he was presented in the PewDiePie video is nothing like he actually is, and he hasn't,
603400	611800	and anyone who did go over to Shapiro's channel probably would be rather disinterested, in spite of his destructive brand of facts and logic.
611800	613000	Next meme!
613000	620360	With The Badae, people were promoting his stuff as it was. No matter how many times people laughed at how pathetic he was, no matter how many times people mocked him,
620360	634600	because a lot of these commentators were constantly punching down, it meant that The Badae was only going to receive traffic, and it wasn't until content creators like BionicPig and J. Aubrey actually began documenting some serious allegations that these ramifications became very clear.
634600	646120	Now, in all fairness, laying the blame, Reaction Commentators is irresponsible, because although they could have kinda guessed what sort of caliber these sorts of people were by judging them, they didn't really glorify them necessarily.
646120	653560	No, the most positive creation came from the numerous compilation sites who found such content hilarious or quote, cringe.
653560	661800	As an aside note, I really don't understand why anyone would spend their day sitting down watching cringe compilations like they're specifically meant to evoke feelings of discomfort.
661800	665640	Do some people get some kind of kick out of that? Is it some weird kink?
665640	668760	Speaking of weird kinks, let's go back to cracking open this egghead.
668760	675160	Once he had accumulated some sort of clout, I mean, hell, he even had his own compilations, the best of The Badae.
675160	679240	Wow, what an icon. If I'm perverted enough, will I get my own best-of compilation?
679240	682440	And this gave him admirals. Why is that?
682440	686600	Why would anyone admire this creature? Because that's what power does.
686600	691640	The Badae, likely being aware of this, used this power for his new followers.
691640	694440	And tried to hold this power over the fangirls.
694440	702840	And sure, there are, like, hundreds of more powerful, more suitable guys on the website, but it's a combination of dodgy judgement and accessibility.
702840	708920	I'm sure there are lots of people who would message PewDiePie if they could, but settle for me instead because I have open DMs on all platforms.
708920	717320	There are many reasons that people admired him, whether it makes logical sense or not, and he used that by sending delightful little videos such as this one.
717320	725560	I mean, you're the cute one here, not me, so...
725560	730680	Now, with attention brought to this, he has been removed from the platform, thankfully, at least I think that's why.
730680	739800	There were clearly numerous allegations, and they shouldn't have been taken lightly, despite the fact that as of writing this, no actual media site outside of YouTube has bothered to cover it.
739800	750200	I don't know if he's been apprehended for these advances, I don't know if he formally broke any laws, but I definitely hope that any future employers see it, though I doubt he'd include it on his curriculum vitae.
750200	756600	The thing about the Badae is that it was easy to catch him out, because he was clearly a massive fucking idiot.
756600	765560	A real moron who clearly has no way of working out when someone isn't interested, and he completely deserves whatever repercussions that come to him for his actions.
765560	775560	However, not everyone is as stupid, there are some people who are extremely smart, are manipulative, and know exactly how to take advantage of the environment that TikTok and other platforms support.
775560	777080	But let's talk about that.
785560	792280	There has been this increasing narrative that given TikTok's astronomical rise, there is this unique threat that it provides,
792280	801880	and watching videos from creators, you can understand the impression, because there are unique parts of TikTok that definitely enable certain features being more easily used.
801880	807560	As outlined, it definitely increases the visible threat, but we have to look below the iceberg.
807560	816760	To gauge how the threat was exactly, I downloaded the app to try and work out the settings, and really, in all fairness, TikTok does give you some decent security.
816760	823400	Now, most of their approach is fairly libertarian, down to the user, they just chuck the features at you, and say have a ball.
823400	832680	Which you know, is what I quickly found out, although the default settings appear to be completely public, and they don't provide any real tutorial or disclaimer that could change it.
832680	842040	And if you're one of those people who just goes into the app on default settings like I do typically, you might not be made completely aware that you can make your account more secure.
842040	847560	But it's down in the privacy and safety tab on your account bio, and here you can change things.
847560	856600	Most of the settings you can set to everyone, apart from the messaging feature, which can only be set to friends at its most expansive, which is a nice touch at least.
856600	865400	There is nothing specifically about the privacy settings that make TikTok much worse than many of its contemporaries, so it really just comes down to the environment,
865400	877240	and unfortunately, despite all the narratives that TikTok could be a platform for predators being completely valid, there is nothing particularly unique about it that causes that, other than its own format and abnormal popularity.
877240	886600	If you want, you can turn off duets as well, but at the same time, I'm sure many TikTok creators think any publicity is good publicity, even when they're being mocked in their replies.
886600	895320	It's a vanity-driven community that makes people more online, often more open than they should be, and when you have creeps, they're gonna be leaving their settings open to everyone.
895320	902200	Because that's how they'll end up with a couple infatuated people in their friend request, and suddenly you've created this situation.
902200	908920	There is no doubt to me that there are probably loads of creeps out there on TikTok, but what can be done when they hide in plain sight?
908920	918280	The specific problem with TikTok particularly lies in the power it bestows onto a particular demographic that are more likely to contain sexually suspect individuals,
918280	923880	bolstered by a culture of irony that finds humour in the juxtaposition of these individuals' existence.
923880	932600	The thing is that what this video should have documented is that it's a dysfunctional setup that is completely perpetuated by pretty much every single actor involved,
932600	939080	and as long as there's money in the market, it's really hard to hold a certain individual accountable, other than the predator.
939080	948840	Equally, although the narrative has been drummed up about TikTok, particularly given the younger audience, we have to ask ourselves how avoidable are these situations in the grand scheme of things?
948840	955720	TikTok is receiving its attention because of the size. This happens on a regular basis on the internet. What do I mean?
955720	964920	Well, we live in a nation, and in that nation there will be some wrongdoings. Now, that nation can take precautions, but it can never fully eradicate it without being overly censorious.
964920	975160	The problem is, what can be done without too broadly applying a guilt by association, and preventing an application from competing on a market, as much as I loathe it?
975160	984440	I mentioned this briefly at the start, the internet is its own environment at this point, and it operates like no other environment that we've witnessed in the past, the Wild West of sorts,
984440	996840	and politicians constantly trip over themselves trying to complain about various aspects because they don't understand the accessibility it has in normalising many things that wouldn't be considered normal in many real world communities.
996840	1009720	It allows people to express themselves in new ways, for better and for worse. Equally, although addictive, it's detachable. In some ways, the detachability is good, even though the internet does bring people closer, it puts a barrier in between,
1009720	1022120	which is why I never fully fell into any of the traps that may have been laid for me when I was a younger lad, because although I did feel that it was quite an intimidating environment, I had that power to just not comply with whatever was going on,
1022120	1040040	and if I became exceptionally uncomfortable, I could just turn the computer off, which did happen from time to time. But equally, the veil of anonymity works both ways, and that means that there are very dark sides of the internet, and extremely coercive, manipulative individuals, people who operate on a much higher level than the budday.
1040040	1050840	And honestly, the fact that he was using TikTok to predate children should be enough evidence that he was thick as shit. But still, TikTok presents a new interaction between old and young that can be rather unnerving.
1050840	1061640	I understand that, but where do we draw the line? Because I'd love to end all non-sory tomorrow if I could, and that's why we've made it illegal. That's why there have been a lot of laws in place regarding it.
1061640	1079080	TikTok is its own international platform, it's its own environment, and there will be circumstances that are unavoidable to an extent. You could impose an upper age limit for adults, but age limits normally rely on relative maturity, and predators can be of any age, and once you reach a certain age, you can't necessarily tell that.
1079080	1096760	You could increase the lower age limit, which is what sites like Twitter have done to increase personal accountability and avoidance of child exposure. TikTok did in fact consider raising it to 16 at one point, which would have been fairly proactive, considering that people like the budday were targeting individuals 13, 14, 15.
1096760	1112840	However, they quickly changed their tune and only raised it to 13, which is an improvement, but was probably motivated by the fact that some of their biggest stars would have fallen foul to this change of policy. Annie LeBlanc, for example, has 13.6 million followers, and is only 13 herself.
1112840	1133000	On top of this, there are many ways for underage people to bypass such age limits. As a threshold for idiots, I guess it works, but I remember the first time I experienced an age limit, RuneScape, didn't take me long to traverse the challenge. It might stop underage kids from being TikTok famous, but it wouldn't stop them from being on the platform, and that's one of the biggest dilemmas of the market.
1133000	1153480	I'm sure TikTok doesn't want any predators on the platform, but their number one priority will always be the dollar. For all my criticisms of TikTok, it is innovative. It has implemented new ideas and new formulas that have yielded a new longevity and a new income, and the problem is, now the cat's out of the bag, even if they removed it, another business would be sure to jump on it.
1153480	1173640	And their features don't specifically promote any predatory actions, they're all just small things that may cultivate an environment where it is possible for slightly twisted individuals to gain clout, and as documented, there are clearly inside and outside influences and cultural problems that create a narrative more clear, so let's put it all together for this final part.
1183480	1208360	The thing is, TikTok's duet feature is a great marketing tool, and it's absolutely genius in many ways, and promotes some ironic content that motivates people to interact with it on a longer basis. It will probably fade into the background eventually, but for now it may well continue to dominate the landscape for a long time, but there are many justified concerns that such a behemoth will always yield.
1208360	1222920	I think the whole TikTok prototype situation can reflect a greater criticism of culture, not just specifically the platform, however I would have some suggestions that maybe they should take forward that wouldn't require necessarily losing out your complete business model to another brand.
1222920	1244280	Maybe this could just begin with a bit more obvious outline of the privacy settings, assuming the best is always optimistic and if they want to change it they can, but maybe just bringing attention to the fact that they can change it because I'm sure the hyperactive child doesn't really pay much attention to the privacy settings that are incurred on the platform. If there's a parent involved, they may take preference to that as well.
1244280	1266520	Equally, I'm aware that it is ageist to assume that every old person on the platform is a creep, and that culture should never be just restricted to age. However, when you are making a platform with an age limit that supports children under the age of consent in many countries, I would still recommend monitoring that content more closely and making sure innocent videos are not being taken advantage of so easily.
1266520	1285480	We've had similar situations like this before on YouTube. Kids were innocently uploading content, and people were taking that content and reframing it for fairly sinister purposes. At the end of the day, you can't necessarily prevent some of these things completely, but you can keep a heavy tab on them, so that when their context might change you can intervene appropriately.
1285480	1310920	If someone gets off to someone existing, for example, we can't stop the victim in that instance from existing. We have to ask ourselves how much can we restrict, and how much we can prevent. It is an age old issue of what liberties need to be preserved. It is a difficult question, but the thing is, I think although TikTok can make some of their features more salient and make it safer, it's equally just a case of making sure people are being educated. What do I mean?
