start	end	text
1308080	1310880	as a bunch of pissed off Behind the Meme fanboys?
1310880	1314080	But I didn't do that because it simply wasn't true.
1314080	1318480	I had to swallow my pride and acknowledge that a lot of the criticism was fair
1318480	1322240	and I used that criticism to gradually improve my approaches.
1322240	1323360	And guess what?
1323360	1326320	I don't get as many dislikes on my newer videos.
1326320	1330640	I made the dislikes go away without having to shamelessly hide them.
1330720	1332640	IT'S TIME FOR THE PILL!
1346160	1348560	YouTubers tend to fear dislikes.
1348560	1352880	Even though as a YouTuber, dislikes are one of your most valuable assets.
1353520	1355840	It's easy to preach to your own choir.
1355840	1360320	It's difficult to preach to strangers who have never seen you before in their lives.
1360320	1363200	YouTube is all about appealing to niche audiences.
1363200	1368160	But the more you grow, the harder it becomes to have all of your audience on the same page.
1368160	1370400	If you're starting to see more dislikes,
1370400	1374800	well it probably just means that your channel is starting to grow outside of its comfort zone.
1374800	1375760	And that's okay.
1376320	1379600	Dislikes are just a natural part of growing on YouTube.
1379600	1382720	They're a sign that new people are watching your videos.
1382720	1386240	You can either accommodate the new viewers or stick to your niche.
1386240	1387440	The choice is yours.
1387440	1391920	But if you so choose to treat dislikes as a germ that must be eradicated,
1391920	1395680	don't be surprised when eventually the new people stop showing up.
1395680	1399280	Dislikes are one of the only lines of communication between you,
1399280	1403920	the creator, and the audience member who is discovering you for the very first time.
1403920	1409200	Most people won't spend the effort to type up a comment or click on any link you have in the description.
1409200	1413120	But at the very least, they will press dislike on your video.
1413120	1416080	And yes, some of the critics are going to be unreasonable.
1416080	1420320	And you can never please everybody and you shouldn't try to please everybody.
1420320	1423440	But critics will give you something that your fans won't.
1423440	1426240	And that's honest, unfiltered feedback.
1426880	1430480	Truth is one of the most valuable resources no matter where you go.
1430480	1432240	From the looks of last year's Rewind,
1432240	1436800	it would seem that the YouTube community is really trying to tell YouTube the truth.
1436800	1437600	Let's hope they listen.
1437600	1440320	...unexpectedly broke a record with Rewind,
1440320	1443200	creating the most disliked video on the internet.
1443760	1446400	Even at home, my kids told me it was cringey.
1446400	1448320	We hear you that it didn't accurately show...
1448320	1452320	A dislike on a YouTube video has never harmed a person.
1452320	1454480	They only harm egos.
1454480	1459120	There's a reason why YouTube only suddenly decided to start talking about dislikes
1459120	1461840	after their video became the most disliked in history.
1461840	1463520	It's not a coincidence.
1463520	1467440	Dislikes make people pay attention and yank them back down to earth.
1467440	1471760	There's no bigger wake-up call as a YouTuber than seeing that ratings bar dip below 80%.
1472640	1474720	Or in YouTube's case, below 20%.
1475600	1476800	It gets to you.
1476800	1477760	You remember that.
1477760	1479840	It's a big fat slap on the wrist.
1479840	1483200	It forces you to stop and re-evaluate what you're doing.
1483200	1487280	It makes you wonder that maybe you're not as good as you think you are.
1487280	1490560	Critics will tell you the truth and won't sugarcoat it.
1490560	1494640	You can argue about how they're wrong all you want, but they don't think they're wrong.
1494640	1498400	And there are many people who probably agree with them and not you.
1498400	1499600	Are they all wrong?
1499600	1501360	Or are you just out of touch?
1501360	1503520	One of these is far more likely than the other.
1503520	1507440	But once again, whichever one you want to believe is your choice.
1507440	1508480	So choose wisely.
1511200	1515680	You know, sometimes you get dislikes on YouTube videos because people meant to press like,
1515680	1518000	but they accidentally pressed the wrong button.
1518000	1520960	And obviously it's not that big of a deal because
1520960	1523840	at least they didn't press the wrong button on something more important.
1523840	1527680	Like, say, deciding the future of internet regulation for an entire continent.
1528560	1532240	We interrupt this program to bring you downward spiral.
1532240	1533120	That's right, Europe.
1533120	1537600	You had elected officials literally press the wrong button while voting for some of
1537600	1541040	the most influential internet regulation in your lifetime.
1541040	1543040	Oh, you stupid son of a-
1543040	1545040	I'm sorry I'm not good.
1545680	1547760	Please forgive me.
1547760	1550000	I'm just European.
1550000	1553680	If your elected officials can't even be trusted to press the right button,
1553680	1556640	maybe it's time to take matters into your own hands.
1556640	1559840	NordVPN will not only protect your privacy,
1559840	1563760	but it will also protect you from the stupidity of your world leaders.
1563760	1568000	NordVPN lets you change your IP to over 50 countries around the world
1568000	1571600	and over 30 countries outside of the EU's jurisdiction.
1571600	1575760	Use NordVPN to anonymously launch a dislike mob against your enemies
1575760	1580080	and use code EMPLEMON to get 75% off the three-year plan.
1580080	1585040	Check out the link below or visit nordvpn.com slash EMPLEMON.
1585040	1585440	Do it!
1586640	1589280	Hey everyone, Post Video Emp here.
1589280	1593360	I just wanted to thank NordVPN again for sponsoring this video.
1593360	1594800	And my patrons.
1594800	1595840	But most notably,
1595840	1597200	Internet Historian,
1597200	1600720	hmaxbstc811b34,
1601280	1602800	Hank Love Smith,
1602800	1603520	TheRealG,
1604160	1605520	Sean Collins,
1605520	1606960	Jack the Whacked Out Cuck.
1607600	1612000	If you're still watching at this point after the video has ended and after the ad has ended,
1612000	1613920	then I gotta give you props.
1613920	1614880	You have some patience.
1615360	1618080	My next video is going to come as a bit of surprise to a lot of you,
1618080	1622240	and it's going to be very different from anything I've made over the past year and a half.
1622880	1623760	So stay tuned.
1624480	1626800	Hopefully this one won't take two months.
