start	end	text
1247700	1252420	paleontological discovery could end up in a billionaire's vacation home, entirely
1252420	1256560	unavailable to those that can do anything more than look at it.
1256560	1260840	Driven by new technology, new interest, and record-breaking sales, the treasure hunting
1260840	1266640	industry is in a renaissance—the artifacts of old are as relevant as ever. And as records
1266640	1271000	continue to break, the drama surrounding these treasures will only mount as the question
1271000	1277280	of who owns what becomes of higher stakes and higher value.
1277280	1282660	Even unexpectedly, there is a weird connection between the fields of paleontology and statistics.
1282660	1287460	That's because paleontology is all about using rare fossils to make big conclusions
1287460	1291660	about the past. That's also pretty much what statistics is about—the field uses
1291660	1296620	math to analyze limited data in order to make conclusions, and so by quantifying fossil-related
1296620	1301500	data, statistical paleontologists are able to study the past. This ability to turn limited
1301500	1306680	data into useful conclusions is exactly why I find statistics so fascinating, and why
1306680	1310660	it was one of my favorite courses I took with our sponsor, Brilliant.
1310660	1314780	Brilliant is a STEM learning platform that helps you learn by doing. They don't just
1314780	1318460	give you a deluge of text and expect you to remember everything—they use interactive
1318460	1322700	exercises to teach intuitive principles, then build these principles upon each other so
1322700	1327820	you can end up genuinely understanding something like statistics or calculus or astrophysics.
1327820	1331260	They truly know how to teach for results, which is why Brilliant is perfect for the
1331260	1334700	kind of person who wants to learn because they love it, not because they're being
1334700	1339260	forced to. Best of all, with their mobile app and bite-sized course chunks, it's really
1339260	1343320	possible to fit learning on Brilliant into any schedule. So, if you're the kind of
1343320	1348720	person that loves learning, you can try Brilliant free for a full 30 days by heading to brilliant.org
1348720	1354400	slash wendover. The first 200 of you will also get 20% off Brilliant's annual premium
1354400	1355080	subscription.
