start	end	text
2850660	2856900	they write about what's actually sexy amazing stunning brave and what should be pined after
2856900	2863780	it just so happens to be how they look and it's generally kind of hideous and then when they bump
2863780	2870020	into somebody who is in some way hideous in the exact way that they've written about but does not
2870020	2875620	share their politics maybe they have some problem that is not socially acceptable to admit like you
2875620	2880180	can go online and say you have all sorts of different mental problems but if you know if
2880180	2883700	you're actually an incel like if you're someone who can't get a girlfriend and you're like depressed
2883700	2886820	about it and you feel like the world's out to get you you're kind of on the lowest rung or the totem
2886820	2892020	pole when it comes to men yeah body positivity doesn't apply to them body positivity doesn't
2892020	2898340	apply to say short men or thin women or women who have suffered from anorexia or bulimia the rules
2898340	2905700	that have been set out in this video are only valid if it helps that intersectional lefty cause
2905700	2910980	which is why at least to me it seems like a big old bunch of bullshit and that being said whenever
2910980	2917540	i see somebody demand something regarding body positivity i just laugh at them because i know
2917540	2921860	that they're living hypocrites i'm still going to tell the same jokes i'm still going to laugh at
2921860	2927140	the same things you're still going to be ridiculous when you complain that the new resident evil game
2927140	2931620	has a fat guy and they're like how dare you link fatness with gluttony and it's like you do that
2931620	2936580	every time you complain about capitalism and post a caricature so you know what i'm willing to bet
2936580	2940900	that if you're actually out here talking about body positivity you're just a fucking hypocrite
2940900	2945700	and there is no reason anyone should believe you and if you want to actually be body positive
2945700	2950500	then encourage people to self-improve help the fat person at your local gym
2950500	2955700	tell them they can make it because you know what we're all gonna make it bros for real
