start	end	text
1440060	1443420	they had to eat whatever they could get it, get their hands on. And two, because they were very
1443420	1450700	poor, even after slavery was abolished. And so this culture of cooking very unhealthy,
1450700	1457260	but very cheap foods and making them taste very good came about. And grandpa keeps serving this
1457260	1462100	food because he's black and it's part of his culture. And even though he's no longer poor,
1462100	1467180	the way that he was when he was young, still feels a cultural impetus to serve this food.
1467180	1473820	And of course people eat it and they fucking like fall asleep in the restaurant because it's just
1473820	1479500	so, you know, insulin overpowering. I'm pretty sure some even has like a heart attack in the
1479500	1483020	restaurant. I haven't seen the episode in years and years, so I don't know. But basically the
1483020	1490740	point is, is that even then, even in this woke lefty show, they said our ancestors ate this
1490740	1497420	stuff because they had to. And even though it is a cultural celebration, maybe we can also move past
1497420	1503020	it. Since then, instead of moving past it, they've decided to simply make being fat part of black
1503020	1508460	culture. All right. Plus sized women admit they aren't attracted to overweight men. Wait, wait,
1508460	1514220	wait a second. Why are the women plus sized and the men overweight as a plus sized woman? There's
1514220	1519260	this expectation that she'd only date overweight men. These women open up about dealing with the
1519260	1525140	stigma of being plus sized and refusing to settle and date overweight men. Well, hold on. Do you
1525140	1529980	think that like regular sized men should settle and date you? Like, why is it settling when you
1529980	1535620	do it, but not when they, what the fuck is this? Sometimes I feel guilty because I'm not attracted
1535620	1540860	to bigger guys, even though I'm plus size myself. I find it rare to find a big guy that takes care
1540860	1545540	of his appearance and hygiene the way I do. I'm a plus size woman, but I'm not attracted to big
1545540	1550460	guys. I get a lot of hate and criticism for that, but I can't help that I like average to muscular
1550460	1556980	types. Well, it sounds like you need to decolonize your thinking on this and become more attracted to
1556980	1562300	fat people. I'm plus size and I'm not attracted to really big guys. I've never been ruder me. It's
1562300	1566620	just not my thing. Everyone has a body they like to look at and overweight man is not one of mine.
1566620	1571860	I feel so hypocritical. I'm plus size and I'm not attracted to bigger guys. I only like average body
1571860	1576460	types. Not a ton of muscles, just average. I hate when people think I have to date bigger guys
1576460	1580900	because I'm plus sized. I can't help that I'm not attracted to them and I like muscular guys. Look
1580900	1587460	at all this colonized thinking. I can't help it. Yes, you can. Thinness ain't an accomplishment.
1587700	1593100	Weight loss ain't an accomplishment. I know y'all hate fat people and fatness so much. You believe
1593100	1596980	the size of your body should be can praise and congratulate it over. So now we've moved past
1596980	1602620	don't talk about your accomplishments into it's not even an accomplishment. This process is like
1602620	1609820	Yuri Bezmenov applied to fat people. Things have gotten so ridiculous that I think this is in the
1609820	1617320	UK. I'm pretty sure it's in the UK. There was a proposed law to make it illegal to alter your
1617320	1624780	online photos that you look thinner than you actually are. Tory MP Dr. Luke Evans said doctored
1624780	1631700	Instagram images are creating a warped view of beauty and fueling a mental health crisis. We
1631700	1636340	will monitor your social media and if it does not show you exactly as fat as we think you are,
1636500	1642860	we will fine you. And of course to go along with all these takes an entire industry of like,
1642860	1649620	I don't know how we'd even even call it like alternative science has appeared to fuel and
1649620	1656100	feed these people no pun intended. All of the reassurance that could ever possibly want. Fat
1656100	1662260	is not the problem. Fat stigma is. Health experts, notice how the word experts is in quotes this time
1662260	1666820	around when it goes against the narrative, are sending incorrect and destructive messages about
1666820	1673460	the relationship between weight and wellness. Are you sure? Obesity is the biggest threat to the
1673460	1678500	health of our nation. This all too common suggestion does far greater damage to public
1678500	1684740	health than fat tissue itself. When the focus is on weight and body size it's not obesity that
1684740	1689340	damages people, it's fear mongering about their bodies that puts them at risk for diabetes,
1689340	1695020	heart disease, discrimination, bullying, eating disorders, sedentariness, lifelong discomfort in
1695020	1700620	their bodies and even early death. Really, so it's fear mongering about their bodies that cause all
1700620	1705980	this shit. Not being so fat that you look like a naked chicken. The data refutes long standing,
1705980	1711900	widespread and incorrect notions about health and weight. Like the fact that fat is a primary
1711900	1717700	driver in metabolic disease or that weight loss prolongs life or improves health. None of this
1717700	1724580	is true. Meanwhile, next fucking paragraph, it is true that many diseases are more commonly found
1724580	1734340	in heavier people. However, that doesn't mean that weight itself causes disease. Blaming fatness for
1734340	1738820	heart disease is similar to blaming yellow teeth for lung cancer rather than considering that
1738820	1745620	smoking might play a role in both. Okay, so we will get into the science of this a little bit
1745620	1751780	later but I just want you to keep this article in mind when we do, okay? Oh god, look at the
1751780	1758580	header for this article. Fat is not a bad word. For me, fat is a way of saying fuck you. No matter how
1758580	1765380	people use it, fat is not a bad word. Fat is not an indication of value, health, beauty or performance.
1765940	1772100	Fat is a descriptor in the same way that black and queer are descriptors and fat is somewhat similar
1772100	1777220	to black and queer in more than just that way. It's a word that encompasses a marginalized
1777220	1781940	identity. Okay, so hold on a second, hold on a second. I gotta parse this properly here, okay?
1783220	1789940	It's a marginalized identity so you're identifying as fat. Well, unlike black and for the most part
1789940	1796500	unlike queer, you can just lose the weight and I mean presumably you're not going to be like a
1796500	1805380	trans fat where you identify as skinny while you're fat or vice versa. Trans fat? Yeah dude.
1810260	1817220	How fat is weaponized and the reclaiming of the word goes beyond size. Fat stigma is also tied to
1817220	1823940	anti-blackness in that being black is the abundance that white supremacy seeks to shrink. What?
1824340	1824840	How?
1828500	1836900	So, does this mean that being a fat white guy, I'm no longer a white supremacist? Am I black
1836900	1844420	now? Am I part of the abundance? My definition of fat is black as fuck, multi-dimensional
1844420	1849700	and futuristic. I don't know, I don't know how futuristic. It might not last another five years.
1850500	1857780	Fat means I exist. Fat means taking up space and demanding more. Fat means black. Fat means fuck
1857780	1863540	you. Fat means human. Fat means creating a world full of possibility without shame.
1864100	1869700	Fat means saying fuck you. It honestly sounds like the way that she writes it, fat means being
1869700	1874900	a colonizer. Like you know how you see those pictures of like the really fat guy in a suit
1874900	1879220	and it's like the capitalist and he just has like a ton of money and he's huge and like the
1879220	1884980	working class is like a skeleton like just barely scraping by on like one coin. So when this person
1884980	1892260	says fat means taking up space and demanding more, they're literally just like I want to be
1892260	1899060	the oppressor class. How to have sex with a fat girl. Touch, and I cannot stress this enough,
1899060	1901780	the fupa, this this picture.
1904420	1912580	Hold on, what's a fupa? I don't know if I want to know. The fat upper pubic area.
1918180	1925220	What? Oh my god, it's it's it's the gun. That's what it is. It's like that second stomach that
1925220	1932420	kind of comes out in front of the pubic region. The first the first few times I fucked as a fat
1932420	1939860	girl I exclusively wore my boyfriend's superman hoodie to hide my body. I was 16, a size 14 and
1939860	1947380	it was 2009. Long before body positivity hit the mainstream or my tumblr feed. Now as a 26 year
1947380	1953700	old woman wearing a size 20, sex has changed year after year as my body has gotten bigger and the
1953700	1960340	dating pool has gotten smaller. With plus size partners, we can press our bellies together,
1960900	1967620	grab each other's bodies and enjoy the thickness of our flesh in privacy. Touch the fupa.
1968660	1975300	It's a universal truth known by fat girls that the fupa is the most intimidating part of our body.
1975940	1982260	I know this because my fupa has been touched so little that I'm surprised she hasn't shriveled up
1982820	1991220	and fallen off. The hottest the hottest hookups are the ones that grab my belly like it's a third
1991220	1997620	tit. Kiss the flesh on the way down to the kitty and aren't pretending my body is less than it is.
2004900	2010100	There's a lot of things I regret. I think at this point you kind of know where where all this is
2010100	2016180	going. Diet culture and weight loss programs are a scam. Plus sized elf makes a joke of women's
2016180	2023540	bodies. Two fat professors are afraid of COVID-19 causing fat phobia. Speaking about health is
2023540	2030100	traumatizing for some who are impacted negatively by diet culture. Dear men, stop working out.
2030100	2034740	Physical fitness creates a cycle of toxic masculinity that must be eradicated.
2034740	2041460	On thinner bodies the strawberry TikTok dress skews a tiny bit fascist. I don't even need to
2041460	2046100	like read the content of these articles. I'm pretty sure at this point you can just imagine
2046100	2053220	what they say and you'll be right. The only way to be a proper BIPOC ally, to be anti-capitalist,
2053220	2058980	anti-fascist is to simply be more abundantly obese. Everything in this video is factually
2058980	2062420	correct by the way and if you disagree you simply haven't done enough research on the history of
2062420	2069540	fatness. Stay mad. I don't know how much work I can take but fine. The obesity epidemic isn't
2069540	2073380	real and it shouldn't be an anti-capitalist talking point. When someone unironically
2073380	2077380	references the obesity epidemic or even uses the word obesity it tells me they really don't know
2077380	2080980	what they're talking about when it comes to fatness. This use of the word obesity stems
2080980	2085540	directly from the BMI which was created by a eugenicist with no medical training who based
2085540	2091140	the scale only on white bodies and cow math. Fatness is not an epidemic. Fat people existed
2091140	2096260	before capitalism and before colonization. Fatphobia is a direct result of anti-blackness
2096260	2100260	and it has deadly consequences for many groups of indigenous folks and other people of color
2100260	2105460	as well as fat folks. When you make the obesity epidemic a real symptom of capitalism you are not
2105460	2110020	only ostracizing fat people from anti-capitalist thinking but also actively ignoring that the
2110020	2115220	health outcomes related to obesity are more accurately attributed to food deserts and
2115220	2120260	fatphobic discrimination in healthcare. The obesity epidemic was created by western medicine
2120260	2124900	to avoid addressing the actual causes of health inequity which is what we as anti-capitalists
2124900	2133380	should be doing. I would have to like spend the entire day talking about just how many things
2133380	2141220	are wrong in this video. Not only factually but like viscerally. But let's focus on the
2141220	2145220	food deserts thing because that's an important point and that leads us to the next topic of
2145220	2150020	discussion and considering that we are currently talking about the wider political tent that
2150020	2155780	constantly says trust the science believe the scientists there should be no objection to
2155780	2161300	talking about science right? Because as it turns out that is not what happens with food desertification.
2161300	2167700	Now what a food desert is is an area in like a large city where there's no grocery store so
2167700	2172260	there's no place to actually buy fresh food you can only go to restaurants and fast food places
2172260	2177300	and in places like that. But as reported on from the wall street journal what happens when new
2177300	2182500	supermarkets open in food deserts? Not what you think. For years public health advocates have
2182500	2186820	argued that food deserts neighborhoods without grocery stores or other fresh food vendors
2186820	2192020	contribute to a disproportionate burden of obesity and chronic disease among low-income individuals.
2192580	2197940	Ready access to fresh healthy food intuitively seems important for supporting a healthy diet
2198580	2203540	but recent evidence contests the idea that watering america's food deserts will solve the obesity
2203540	2209780	crisis. Compared with high-income individuals poor americans tend to have diets higher in sugar
2210340	2217700	fat and processed foods and lower in fiber fruits and vegetables. This nutritional inequality is a
2217700	2222980	contributor to the large income-based health disparities in the us and is thought to be due
2222980	2228420	in part to more limited access to healthy food. But does introducing a supermarket into a food
2228420	2232900	desert change the grocery habits of nearby residents? Not so much according to a recent
2232900	2239140	study. Researchers found that less than one-tenth of the nutritional inequality between high and
2239140	2246100	low-income households can be explained by the availability of healthy foods. The other 90% was
2246100	2254260	due to differences in demand. So even when you give people who are overweight the option to buy
2254260	2259620	healthy food they still don't do it. It's more than simply living in the ghetto and not having
2259620	2265060	access. It is a deeper problem than that. This is fucking ridiculous. People aren't obese because
2265060	2271380	there's junk food advertisements on before nine o'clock. People are obese because a pack of 20%
2271380	2278740	fat mincemeat is $3.95 and a pack of 5% fat is $5.79. People are obese because a pack of biscuits
2278740	2285540	is 20 pence and a pack of apples is two pounds. The actual problem seems to be a lack of knowledge
2285540	2293140	about how diets work. Dietary fat does not equate into body fat. In fact you're much more likely to
2293140	2297860	gain body fat from eating carbohydrates than you are from eating dietary fat and even then
2297860	2304260	it's based more on how many calories you burn. How much exercise you're doing is calories in
2304260	2310020	calories out. That's how it works. Your body does not violate the laws of thermodynamics.
2310020	2316740	You are actually better off buying that pack of 20% fat meat over the 5% fat as long as you're
2316740	2323140	also not eating an entire loaf of bread a day. The problem is sugar, it's carbs, it's gluten. That shit
2323140	2329140	is just empty calories with no nutritional value that just makes you hungrier. And people just don't
2329140	2335060	want to hear this even though it's the truth. Outrage as Whole Foods CEO says ignorance and
2335060	2341540	poor choices cause obesity. It's the truth dude. Overweight and healthy is a big fat lie.
2341540	2345940	Our findings refute the notion that a physically active lifestyle can completely negate the
2345940	2351780	deleterious effects of being overweight and obesity. You cannot be fat and healthy at the
2351780	2358340	same time. Even a fat person who you know lifts weights and runs and does all those things but is
2358340	2363620	still fat they would be much healthier without all the body fat. In fact check this out check this out
2363620	2368980	skinny jeans are the secret to staying slim. Oh shit is it all actually just genetics?
2368980	2374100	Researchers found that people who were obese were more likely to have a set of genes linked to being
2374100	2380180	overweight. Meanwhile people who were skinny not only had fewer genes linked to obesity
2380180	2387700	but also changes in gene regions newly associated with healthy thinness. So of course as with
2387700	2393220	everything in the human condition there is a genetic biological component. But I guarantee you
2393460	2397700	take the obese person with obese genes and throw them under the wild and just have them
2397700	2403860	starve they'll get thin. In fact a professor of nutrition and dietetics professor Tom Sanders
2403860	2409060	said this is an important study confirming that precocious severe obesity is often genetically
2409060	2414740	determined. But he also added most obesity is acquired in adult life and is linked to the
2414740	2419460	environment we live in. A sedentary lifestyle and abundant access to calorie dense foods.
2419460	2425460	Whatever your shape or genetic makeup the age-old advice of a healthy level of exercise and good
2425460	2432100	diet still stands. This is an article that fat activists constantly cite and they've only ever
2432100	2436500	read the headline and this is why you get shit like this. Does obesity really not cause any
2436500	2442980	health problems? I never knew. What I say what we always say is that being fat is not proven to
2442980	2449220	cause any illness only correlated with and that correlation is not causation is a basic principle
2449220	2454500	of science. However many of the illnesses that are correlated with fatness are proven to cause
2454500	2459220	weight gain or medications to treat them are. We also point out that there is no such thing as an
2459220	2464500	illness that only fat people get. This is the problem with scientism and I'm going to have to do
2465220	2471380	a video on science versus scientism at some point but basically if you have already ideologically
2471380	2476660	predetermined your end point then you simply pick and choose all of the science that leads you there
2476660	2481860	and ignore all the science that disagrees with you. Case in point fat sex therapist
2481860	2488260	compares fitness trainers to nazis children dieting to sexual assault. I truly believe
2488260	2493460	that a child cannot consent to being on a diet the same way a child cannot consent to having sex
2493460	2500020	says Sonali Rashatwar who attends Saint Olaf College. Rashatwar also believes that science
2500020	2505460	is white supremacist. We should be critical of the use of science and the production of knowledge
2505460	2510740	to continue promoting this idea that certain bodies are fit able and desirable. Is it my
2510740	2516660	fatness that causes my high blood pressure? Yes. Or is it my experience of weight stigma? It's
2516660	2521380	definitely your fatness. She then connected the science suggesting that obesity is unhealthy to
2521380	2529460	nazism saying that fat phobic science is often actually eugenic science. Eugenic science is nazi
2529460	2540180	science. You know you can say the most unscientific shit but simply use a few of the
2540180	2546900	words that some scientists have used in the past and then squint your eyes to make it real fuzzy
2546900	2552340	and then it kind of seems scientific. Even when it comes to modern problems like the coronavirus
2552340	2557220	COVID-19 death rates are 10 times higher in countries where most adults are overweight.
2557860	2562420	There is a link between whether or not you're going to die of coronavirus and if you are fat.
2562980	2569620	I am fat. To get the vaccine I had to say I'm obese. This word has done incredible damage to
2569620	2575060	my body. No, the damage was probably done by the fourth Big Mac you had that day. I understand that
2575060	2580580	doctors are including obese. Did you censor obesity? Oh my god. I understand that doctors
2580580	2586660	are including obesity as an underlying medical condition that leads to death in COVID patients.
2586660	2590740	Do these doctors have any idea what kind of impact this has on families to be told that
2590740	2594740	their loved one's body shape is partly to blame for their death? The impact doesn't matter. It
2594740	2600020	matters the truth. If you die because you're too fat it doesn't matter like the impact it has on
2600020	2604580	your on your family. What matters is that you were too fat and you died because you were too fat.
2604580	2609860	Furthermore when it comes to obesity and COVID deaths we have no evidence of causation and only
2609860	2614900	a weak association that continues to be disproven as times goes by. No it doesn't. What are these
2614900	2620340	junior doctors thinking? Give me one good reason for recording fatness as a cause of death. Well
2621700	2629460	causes of death as we've seen recently with George Floyd and other have been very politicized as of
2629460	2634740	late and I for one am happy to see someone actually telling the truth on these forms.
2634740	2640020	What I've managed to pull from all of this though is that these people are screeching about fat
2640020	2646180	acceptance from all possible angles. Cultural, scientific, representation, ideological,
2646180	2649860	they're using politics, they're using critical theory, they're using socialist theory,
2649860	2656740	they're using post-colonial theory, they're using everything that they can to basically turn fat and
2656740	2662900	thin into another variation of white and non-white or something like that to create more classes and
2662900	2669540	have them clash you know Marxist style. But the honest truth is when it comes to other alternative
2669540	2675300	body types among the broader left there seems to be like a serious hit and miss right? White
2675300	2681780	people calling fully grown Asian women cute is racist. No I will not explain. It's infantilizing
2681780	2688660	as hell. Yeah I'm tired. I'd rather just be called ugly at this point. All right you're ugly.
2688660	2694340	Aquaman looks hot because men want to be him. Carol Marcus looks hot because men want to fuck
2694340	2698260	her. I don't even know who this guy is I keep seeing him on twitter and he seems to be like
2698260	2704580	a grade-a moron. But dude dude do you see are you seriously saying that women don't want to
2704580	2709780	fuck Jason Momoa? Lizzo, who the fuck is Lizzo? You know who cares? Lizzo talks about double
2709780	2714420	standards for critiquing men's bodies versus women's. We don't talk about your dick sizes do we?
2717700	2723860	13 male celebs with seriously big bulges. Cosmopolitan confirmed. Men who objectify
2723860	2729620	women are effing horrible. Also cosmopolitan. 36 summer olympic bulges that deserve gold.
2729620	2736260	How many times how many fucking times has there been like height shaming for men? I've done like
2736260	2742020	a whole height shame video in the past and like you know dick size shaming. Even when the guy in
2742020	2747460	question is tall and probably has like an average or even slightly above average dick size they'll
2747460	2751300	simply throw that out there if they don't like what he's saying. It's like oh you like the wrong
2751300	2755380	politics, you like the wrong sports teams, like the wrong video games, have the wrong opinions
2755380	2759700	online, make fun of the wrong thing, make the wrong joke, whatever. Oh you're probably short
2759700	2765620	and you have a tiny dick. Dude this shit happens everywhere and sometimes it's funny right like
2765620	2770580	you see a guy who has like 10 guns or he has like a giant truck and it's like that guy's compensating
2770580	2777540	hahaha like it's a joke all right and it's fine it's allowed but don't act like it doesn't happen.
2777540	2782660	Do you recall Beachbody Ready? This was I think 2016 or something it was a while ago
2782660	2788900	where London mayor Sadiq Khan banned this shit because it was apparently objectifying because
2788900	2793140	it was a woman who was in shape and very clearly worked to get in shape. It was it was like a
2793140	2797460	protein powder weight loss advertisement and everyone was like how dare you! On February
2797460	2804420	10th of 2020 Sadiq Khan was proud to announce on his official twitter the Nubian skin advertisement
2804420	2810740	which was just like an underwear advertisement and you'll notice it's four plus size women and
2810740	2816900	two dudes with rippling abs. Where's the representation? Where's the outcry? The whole
2816900	2825060	body positive argument falls apart as soon as you see how the left treats people with alternative
2825060	2830980	body types when one they're not fat they're extremely skinny or they're in some other way
2830980	2838820	different or two they're not leftists. It is extremely telling to me that when radical
2838820	2844500	feminist male female whatever doesn't matter when they write about what looks are outdated
2844500	2850660	or sexist or toxic it's always traditionally attractive people men and women alike and when
