start	end	text
1370240	1372560	hahaha
1380240	1385280	i mean at least the map's done nicely that looks pretty nice but that's about it i want to run my
1385280	1394480	hand through it i'll bet it feels nice get your greasy paws off me map that's so textury it looks
1394480	1407040	very textory that's true i'm sorry kibs you racist you look at a black woman is this the
1407040	1413360	person to laughter i'm sorry but like when it comes to cultural you have this like european town
1414000	1420320	and then there's just a random black lady and she has like the black head scarf and and like the
1421040	1423040	like the circles hanging that's like an african thing
1424640	1427840	we just got random diversity scattered everywhere
1429600	1435120	and the worst part it feels like a quota doesn't it oh speaking of diversity hires we got a new
1435120	1443600	character it's a black elf so is he supposed to be some kind of dark elf or is it literally just
1443600	1455520	a black elf okay yep they're all fair-skinned also like i think they've made have fucked up
1455520	1461520	because they mentioned this is the south lands i mean this should be the lands of like
1462320	1466640	let it go i didn't see where the map was painting
1468800	1472560	now still honestly because uh this doesn't look like thinking
1473440	1479280	by the way racism is bad in case you were unaware racism is indeed bad
1480000	1485840	unless it's against elves thank you amazon prime for showing us i hate his hair most of all like
1485840	1491120	sure okay so he's black or portrait hold on look at his breastplate though what about it
1491120	1497680	it's made of wood or something it's made of plastic those are the finest costumes at spirit
1497680	1505280	halloween okay his hair is the thing that annoys me the most because okay he's like it's the
1505280	1509600	current year they've got to have black elbows because reasons but at least they could have
1509600	1517440	given him long flowing hair instead like he is the most anti-elf you can imagine like in in tone in
1517440	1523520	demeaner in appearance because elves are supposed to have long beautiful hair give him long dread
1523520	1531280	locks that's not beautiful we got an interracial relationship now yep kib called it kib genius
1532640	1538640	but another short-haired elf they all seem to be short-haired now pretty much really
1540400	1547200	the elves are talking about their life we gotta have vulgarity you know again they're just
1547200	1552240	people that's the thing they're just fucking people with people's concerns
1554480	1560400	they're just humans they're not even elves my point is that's a cool shot only twice
1560400	1566960	in known he waited till now to speak his point after like three hours of walking
1568800	1573440	listen you just wait for three hours you know my point is actually
1574400	1578480	it's like what what the fuck were you talking about maybe they're just elves from a different
1578480	1587120	region idk that region's called amazon land of amazon basil's high king
1589440	1595680	do you notice also every time they pronounce a name or a place name they change their
1595680	1601600	pronunciation drastically not only they can just talk always talk like that that's the problem
1602160	1607920	most of the time they speak like just regular fucking humans and then when they occasionally
1607920	1614240	inadvertently have to say something that's related to lord of the rings their pronunciation changes
1615200	1619920	to be fair arch you're barely speaking like a human right now damn he's more elf than these
1619920	1627360	characters she's got the hots for that black elf though look at her he knows
1627600	1632640	you know why are you at my home or make
1636400	1637600	oh jesus
1641840	1648960	that's fucking racist all right time for the the action to brew up fellas here we go
1649200	1650800	where are you going dramatic music
1653200	1657360	so obviously the cow's been grazing in corrupted lands
1659840	1664000	corrupted lands they're unaware of you know do they do any reconnaissance whenever we're
1664000	1670080	garrisoned here they just sort of chilled in their little fort and that just waited
1670080	1674400	yeah weren't they there for like 79 years or something they weren't patrolling around
1674400	1682640	attention they're just sitting there twiddling their thumbs it's a lie maybe that's why he's
1682640	1688960	a half no i'm sorry child then what happened to him his dad is the elf though you think so
1688960	1694160	this is the real bouncy that's why he's light brown that's racist kibbs race is a social
1694160	1702640	construct oh that's the evil looking sword he's got the sign sorry just stand there at attention
1705360	1708160	mean to be fair it's the most elven thing they've done so far
1708720	1712640	we wait in full armor what happens if you fall off the boat
1717360	1719920	very descriptive thank you strange how
1722320	1730080	on my way is there a tin can look like it like in the background i'm pretty sure that was a tin
1730160	1732480	can in the background there better than a starbucks cup
1738000	1740080	you're the only one who let me hit it
1742240	1745360	listen he's desperate okay well the warden's fucked up a bit
1749440	1752560	maybe you should have warned the garrison instead of your girlfriend
1753440	1757760	still standing there they've been standing there for fucking days
1761040	1767920	no one can take the sword from you no one's doing anything on the ship they're just standing see the
1767920	1774880	writers think that overs overly ceremonious will be very elven delicate i mean again to be fair
1774880	1779360	this is the most elven they've been so far yeah but even when they get on the ships to valinor
1779360	1787200	and the other movies like they don't wear their full battle garb no no but give them a point for
1787200	1795600	trying i don't give them a point for being amazon barge listen i like my knife i want to stab
1795600	1802720	somebody with it now this is actually a pro second amendment message never give up your arms damn
1802720	1812960	oh my god valinor is an arwelian nightmare so how does luminor work like uh like valinor
1812960	1818560	yeah that's i mean it's our valinor it's like the land of the see i'm not super familiar but
1818560	1823280	i've been starting to read up on the lore a lot more but basically it's like a magical land where
1823280	1827920	nothing dies and so that's why the immortals like elves that go there you know that's where
1827920	1833120	they belong they don't belong in middle earth i see it's the land of the valor the valor
1834160	1838080	so can just anybody sail there or do only elves though how to
1838560	1844480	uh only else mortals can exist in the land works there's sometimes rare exceptions but that's why
1844480	1850560	there's the van then alcom frodo was able to go there they made an exception for him because he
1850560	1855120	did and you know that was only because he was going to die anyways like he would die in valinor
1855760	1859600	it's a mercy because mortals aren't allowed to valinor because they apparently like it's sort
1859600	1865680	of alluded that they age too quickly but immortals are fine there it's also because it's nice to have
1865680	1872560	the ethnostates i think they brought all the ring bears so they brought frodo sam and bilbo
1874320	1878160	yep because like you guys are in it you can you can come on
1880560	1886400	you can join our ethno state you're your exception you guys are honorary ways you can come in
1886400	1897920	nice to follow yeah i reckon i can swim to shore from here i'll just jump out
1899520	1904400	like she literally did no way she's gonna swim all the way back home
1909120	1912720	do you understand writers how far she's gonna have to swim now
1913360	1919920	isn't like a thousand miles like she'll never make it of the atlantic ocean she'll never make
1919920	1924640	it because the currents would pull her away even if she swam as hard as she could that's fucking
1924640	1933040	horseshit she doesn't even have like a trifle to hold on to yeah she's basically dead so uh gg
1934160	1941360	you're dead dead if you do that the natural reaction to anyone seeing a meteorite crash
1941360	1946080	nearby wandered towards the burning wreckage especially if you're like a you know primitive
1946080	1953200	civilization you're not terrified or anything also what's in here what well first the meteorite
1953200	1961440	wouldn't look like this but i guess it's a person crying in the show that's how she's crying too
1961440	1967760	everybody's they have water in their eyes wait wait wait that that is sauron that is sauron
1968720	1974560	oh my episode two is up already what yeah yeah yeah so uh they did like an episode one and an
1974560	1985760	episode two in one day you gotta keep going kibs let's spend a few minutes talking about what the
1985760	1993600	fuck we just watched oh god because we watch okay here here's what a pilot's supposed to do right
1993600	1998400	introduce your characters introduce your setting introduce at least get the conflict started this
1998400	2001680	shouldn't be the first time you're exposed to what lord of the rings is it feels like because
2002320	2010480	this pilot relies on so much past knowledge of everything that's come before the only reason
2010480	2017600	that we care about any of this is because of the previous movies they didn't establish anything
2017600	2025600	that makes us care in this dev you're you're being facetious okay they introduced her brother for at
2025600	2035200	least five seconds and then he died hold on they introduced him he maybe had like two minutes or
2035200	2040640	five minutes of screen time before he died and they foreshadow his death in the introduction
2040640	2046000	to his characters like this story is so rushed like we should have gotten a whole like thing
2046000	2050320	about the the war of wrath rather than just like the war of wrath happened and it was bad
2050320	2057760	i was like okay but but yes so what what what happened in gladiator story she she went through
2057760	2063520	the ice she found evidence of sauron nobody believed her she went back she was being sent
2063520	2068480	away she refused and jumped into the ocean like that that's the tldr of it right but
2069200	2074480	yeah so sauron's returning and things are getting corrupted and all things are bad
2075120	2080880	yes so so the other stories actually had stuff kind of happening in them but it really seems
2080880	2087200	up something but like it's kind of setting up something but it doesn't make you care about
2087200	2091760	any of the characters beyond this is these are people that you already know from previous movies
2092720	2098080	because they're doing the same thing because the the completely new characters they're so bland
2098080	2104320	it's it's the same problem with house of dragons like you are expected to know
2105200	2109840	the reason why you should give a shit like you should care about galadriel because it's
2109840	2118480	galadriel it's given you no other reason to give a shit we also established um oh god elrond but
2118480	2123440	we also established i can't remember the guy's name let's call him black elf or belle for short
2123440	2129840	and we also established yeah belle and uh harfoot lady so we have three story arcs that have been
2129840	2134480	prepped so i somehow they're gonna all intermingle i think the harfoot one's gonna have something to
2134480	2140400	do with the sauron dude yeah i have a sneaking suspicion they're all gonna be kept completely
2140400	2144640	separate and i have another sneaking suspicion that they might actually be taking place at
2144640	2150560	vastly different times oh so that would be really weird well they did that with the witcher and it
2150560	2154240	was fine with the witcher with all the different time periods kind of shifting around fine and
2154240	2160080	fine it was it was a decent show the witcher i like the witcher come on you guys are being
2160080	2165760	apologetic just because henry kevl was in it that's it i've established it to be fair the
2165760	2172400	arrival of sauron is a pretty big deal and but he's not obvious he's the stranger this is part
2172400	2178000	of his ploy yep he's pretending he's gonna be he's gonna blend in with the rest of everyone
2178000	2181840	because he's gonna eventually slip his way to numenor and trick the numenorians into
2182400	2186720	trying to break the ban because they'll be like the elves are you know they're they're preventing
2186720	2190720	from going to valor because they're they're holding all their power and immortality and
2190720	2196880	he's like what really that's they're dicks i want the immortality they're why can't we have it arch
2196880	2201280	i know you and i disagree on house of the dragon like you think it's bad i think it's like okay
2201280	2206000	it's not amazing but it's okay i'm gonna beat you we're gonna beat you i feel like house of the
2206000	2211600	dragon actually set up its principal characters to have personalities way more than this because
2211600	2217920	we know that in that show the king is kind of weak and and he doesn't have a grasp on anything
2217920	2222640	we know that that the daughter is is is intelligent but overlooked we know that
2222640	2227760	her uncle he he's the evil uncle who wants the throne like they set up the characters
2227760	2232640	well enough that we can tell who they are based on personality i don't think this show did that
2233280	2238640	they all just seem to be the same bland person i feel like this show is kind of the same though
2238640	2244000	because this show is also and then and then and then and the house of dragon is and then and
2244000	2249120	then and then it tells us rather than really showing us and when it shows us it's overt
2249120	2252960	it's like look his fingers falling off look he knocked over a statue and broke it
2252960	2259840	seeing his house is coming undone foreshadowing it's a little too on the nose that's the thing
2260560	2265040	dev is actually correct here in that house of dragons has done more like it's
2265040	2271360	it's basic bitch shit the king is literally rotting to demonstrate that his realm is falling
2271360	2276960	apart the uh the princess is the only capable individual that can get anything done and her
2276960	2285760	uncle is like yes yes yes yes yes but at least those are characters galadriel's only character
2285760	2291360	here she is it was actually a brilliant uh comparison she is ray she is the cardboard box
2291360	2296640	that speaks she is strong female character and the other characters they they don't even exist
2296640	2302160	like elrond what we knew about elrond well he writes okay cool uh what about gilgalad well he
2302160	2308240	has like leaves that are made of gold uh he's a king and he's wrong actually that's what we know
2308880	2313360	the show hasn't even really told us about his position like what is he king of is this an
2313360	2319520	important title like is he respected well we kind of know he's king of linden because he's
2319520	2324880	in linden that's the thing you know he's king of linden well you'd assume he's king and he's also
2324880	2331280	in linden ads are but what's linden a normal person what's linden is that the entirety like
2331280	2336320	is that all of it they show you on the map what linden is it's next to ariador but the thing is
2336320	2339600	what they don't really show you is like the borders or anything like that yeah exactly and
2339600	2345200	what's ariador yeah it's like i mean the map has only panned past ariador it's never actually done
2345200	2350640	anything there it's just a thing on the map for the newcomer ariador means nothing and we also
2350640	2356720	introduced them to complete the other else i don't dare like okay who's he why why is he in the
2356720	2364640	southlands the southlands as well that is one hell of a skip and a jump and also they keep present
2364640	2370640	they're presenting the southlands as if they were like major allies to morgoth like they would
2370640	2377280	barely have counted in morgoth scheme like that was not a war of men like that was a war in which
2377280	2383360	balrogs were generals the if i remember right they were more like a vassal state fighting alongside
2383360	2389600	his forces but that's about it so for the elves to like set up a garrison there to police their
2389600	2395120	conquered subjects i don't really remember that being a thing because i i think like the only
2395120	2398720	time they're relevant again from what i know is when the numerians start you know setting
2398720	2403680	colonies and building up stuff over there and they've got a full site the worst part is too
2403680	2410000	i'm actually kind of annoyed they're white they should be brown yeah because we're in the south
2410000	2416160	lands these are the people of ruin right so it should be kind of like southerly like a little
2416160	2423520	bit arabic kind of yeah a mix of arab and mongol a little bit more instead they're just they come
2423520	2429920	across as like just european peasants yeah because yeah you're right so like european so i i don't
2429920	2435840	know the lore the way that that that archon kibbs does but i do know that there are certain places
2435840	2442640	where certain human races come from in lord of the rings and every population shouldn't just be
2442640	2448160	mixed race my impression of like southlands weren't they like the people on the boats that
2448160	2453600	showed up like uh at the third movie they have returned to the king they have like big elephants
2453600	2464800	hey yes those guys um actually those are different oh god because those i i know the name but i can't
2464800	2469600	bring it up because this is from the horadrim right yeah horadrim because this is actually to
2469600	2475920	the east the southlands is past the lands of mordor so this should not look like a european
2475920	2481280	village which is it's interesting isn't it like they've got a force in a black elf but in a
2481280	2487920	position where they could actually have a diverse village like now illy law europe the corsairs were
2487920	2492480	coming up the river or the direction where the river leads to goes to os giliath os giliath is
2492480	2497520	the former capital of gondor ministeroth is actually a uh like city fortress kind of thing
2498000	2501600	the that's the thing that the corsairs are actually white because they're full of
2501600	2507360	numerians oh yeah they are i forgot about that they're the black numerians right
2508400	2513280	yes also the black numerians aren't actually black by the way this is they call them black
2513280	2523200	because they turned evil that's racist i'm sorry but i'm not i don't dare and bronwyn
2523200	2528320	like their romance is not explained it's just like they they meet you see them by the well
2528320	2533360	and they're like i'd like to have sex with you i know but i can't see this is just modern writing
2533360	2537840	because it's the forced interracial relationship that does that comes out of nowhere in left field
2538640	2544560	it's not natural there's no buildup for it i mean galadriel got a prequel okay well introduce the
2544560	2549040	other characters then at the very least i don't they're like arriving you know looking around
2549040	2555520	uh being called a black person for a while then he goes like i think you're cute even though you're
2555520	2561040	black something like something to establish a relationship but they're kind of forcing it along
2561040	2567520	the show is rushing he said like you're the only kind touch i felt okay like there's i'm saying
2567520	2574320	i'm sensing that there's like an implied history between them but it's like we're not we're not
2574320	2580480	shown nor was it told well maybe maybe they'll show it to us that's we want to give him the
2580480	2586000	benefit of the doubt and maybe they'll get a flashback back yeah but that's gonna flashbacks
2586000	2591600	work sometimes for twists but this is kind of on the nose because i swear to god that kid that is
2591600	2597360	his kid you think so oh because his ears are being dead left yep his dad also left because of that too
2597360	2602240	remember and and his ears are all hidden by his hair you think it's gonna be i think i think the
2602240	2605760	elf dude's dad originally is gonna hate him and he's like i don't like you but they'd be like
2605760	2608960	actually you're my dad and you know what we're pretty cool actually and then they shake hands
2609760	2617280	he's also found the sword of sauron which is god damn it don't worry about it that's just
2617280	2625280	lying under the floor that's true most of sauron's artifacts kind of have a corrupting influence
2625920	2630720	well i mean it did kind of glow and look at him a bit that's true everybody's gonna turn evil
2631360	2639440	he's still fine this is the thing um well what they established in the uh original movie trilogy
2639440	2645920	boromir is tempted by the ring by just being near it he's willing to kill his compatriots
2645920	2651520	to her normal human touching an artifact of sauron should be a pretty fucking big deal
2652400	2658720	yep remember the council when they were in uh oh god uh the thing with the e basically
2658720	2663680	elrond's uh fortress city place and they were all fighting and bickering because the rings
2663680	2672480	influence is that powerful yeah yes i'm letting like the different magnitude again like the racist
2672480	2678480	boy look at the stories i was like oh i want it um but it's like the him holding it there's it
2678480	2683680	doesn't even look like it's having much of an effect on him yeah you think that he'd be like
2683680	2689120	instantly possessed or something or at least get like mind fucked should we start the second
2689120	2698160	episode are you ready to go yep might as well oh god here we go the last the evil is gone then why
2698160	2708000	is it not gone from in here i'm sorry oh the opening okay we didn't see it the first one
2708000	2708800	let's watch this shit
2711120	2716480	oh my god that the rings for me on a dust game or show well it's nice to have pebbles
2717280	2722080	yeah it's nicer than what twitter said it was yeah no that's not i thought it would be like
2722080	2729280	them fading in like that thing yeah where did that come from then maybe it was a trailer a fan edit
2730080	2736560	or maybe like 4chan did it to like shitpost i don't know ah she's realized that swimming for
2736560	2742640	you know three weeks straight is uh not working out oh glad you what um was your plan
2744800	2748720	that facial expression is the look of oops i'm a bit retarded oh she's just gonna swim it
2750320	2761040	yeah okay she's in in the lore she's a witch right can she cast water walk probably not
2761600	2769680	is this fucking dnd dev convenient underwear very convenient underwear looks you want
2770480	2775200	soran's first act of waking up is to end up in a sex offenders registry okay
2776960	2780560	in before yeah i was thinking like the gandalf too
2781360	2783360	oh
2793760	2797360	also not to mention there hasn't been a handsome elf in the show yet
2800640	2801520	i was about to say
2805120	2810400	the characters are comedically stupid good you know i'm okay if it's hobbits doing this though
2811520	2821040	uh they're harpots actually for legal reasons he's literally named the stranger
2822880	2829120	yeah so it's definitely sorry listen sorry little baby lad he's misunderstood he's just having a
2829120	2836000	little nappy nap little sorrow nappies even dark lords got asleep somehow i just know he's
2836400	2843920	important hitler was important he is this literally is would you kill baby hitler this
2843920	2850960	is what's going on here damn pretty the show's asking the hard questions we've got female bilbo
2850960	2856560	and like a female sam they're even repeating some of their goddamn dialogue what's the old saying
2856560	2862960	if it ain't broke don't fix it no no it's a different saying it's like poetry it rhymes
2862960	2867760	god damn it that's fine oh shit my new twitter account's already locked fuck
2868480	2871200	well that's what you get for saying that that was god punishing you
2874720	2878400	that damage uh-huh show i'm sure everybody got away fine
2879120	2885040	no bodies you wanted to keep this pg-13 it's a pg-13 it is actually if you go back to the uh
2885040	2890640	the page this dramatic music warn your people you're not coming with me i must follow the
2890640	2894960	passage to the other direction are you gonna tell the wardens why did you call for backup
2894960	2900720	no no no send the woman i'm sure she'll be fine in the middle of the night god only knows how
2900720	2905920	many kilometers away from her home so something bad happened we're gonna send that lady unarmed
2906480	2911920	meanwhile black don't think about it run back home in half the time and give me back again
2911920	2917920	before she was that's right they can run super fast they can yeah they've got great direction
2918800	2920480	my good erection
2936080	2940000	at least they're establishing the reason why he's going to be talked into making the rings
2947920	2952960	hot as a dragon's tongue and as pure as starlight the things we could use it to create could
2952960	2960320	transform middle earth nothing bad could ever be created from such a thing don't worry about it
2961360	2967360	have you considered seeking partners outside the confines of our own race feel far outside
2970080	2975120	you gotta be a free marketeer man they don't have montages for when they move across man they just
